"BYLINE","DATE","DATELINE","HEADLINE","LENGTH","PUBLICATION","SECTION","TITLE",
"Gerald Mulwanda, Times of Zambia (Lusaka)","","","Sports - General;Zambia Open Golf Competitors Trickle In","395 words"," Africa News","","",
"Times Reporter, Times of Zambia (Lusaka)","","","Zambia;Pressure Group Speaks Out","363 words"," Africa News","","",
"Times Reporter, Times of Zambia (Lusaka)","","","Zambia;Trade Unions Plead For Small Firms","207 words"," Africa News","","",
"Times of Zambia (Lusaka)","","","Zambia;Human Rights Commission Should Not Be Impeded (Editorial)","377 words"," Africa News","","",
"Times Reporter, Times of Zambia (Lusaka)","","","Zambia;Hands Off Rights Body, Politicians Cautioned","389 words"," Africa News","","",
"Times Reporter, Times of Zambia (Lusaka)","","","Zambia;Farm News Roundup","436 words"," Africa News","","",
"Times Reporter, Times of Zambia (Lusaka)","","","Zambia;Entrepreneurs Advised To Improve On Products","219 words"," Africa News","","",
"Gwen Lister, The Namibian (Windhoek)","","","Namibia;Pohamba Accuses 'Namibian' of Lying","266 words"," Africa News","","",
"Christof Maletsky, The Namibian (Windhoek)","","","Namibia;DTA Slams 'Interference In Judiciary'","360 words"," Africa News","","",
"Kate Burling, The Namibian (Windhoek)","","","Namibia;Oil Seeps Into Sea At Swakop","433 words"," Africa News","","",
"Tabby Moyo, The Namibian (Windhoek)","","","Namibia;Economist Warns: 'Civil Service Cuts Unavoidable'","440 words"," Africa News","","",
"Tabby Moyo, The Namibian (Windhoek)","","","Southern Africa;N$35m Cattle Disease Appeal","230 words"," Africa News","","",
"Chrispin Inambao, The Namibian (Windhoek)","","","Namibia;'Small is big' for mining","222 words"," Africa News","","",
"UN Economic Commission for Africa (ECA)","","","Africa-at-Large; African Minerals And Energy Ministers Meet In Durban","847 words"," Africa News","","",
"UN Economic Commission for Africa (ECA)","","","Africa-at-Large; African Statistics And Information Days","713 words"," Africa News","","",
"Ghana Focus (Accra)","","","Ghana;Ghana's diamond-mining town of Akwatia deserted","356 words"," Africa News","","",
"Ghana Focus (Accra)","","","Business and Finance;Nigerian Fraudsters operating in Ghana","481 words"," Africa News","","",
"U.S. Department of State","","","United States and Africa; U.S. Statement on Luxor Temple Killings","218 words"," Africa News","","",
"The White House (Washington)","","","United States and Africa; Clinton Receives New Ghanaian Envoy","1625 words"," Africa News","","",
"The White House (Washington)","","","United States and Africa; Clinton Supports Comoros 'Territorial Integrity'","1502 words"," Africa News","","",
"Truth and Reconciliation Commission","","","South Africa; Tutu Saddened by Botha Refusal to Testify","385 words"," Africa News","","",
"Truth and Reconciliation Commission","","","South Africa; Truth Commission: Deadline Approaching for Rights Reports","327 words"," Africa News","","",
"John Yeld, Cape Argus (Cape Town)","","","South Africa;Vlakplaas pistol 'used in robbery'","549 words"," Africa News","","",
"Political Staff, Cape Argus (Cape Town)","","","South Africa;ANC crackdown looms for Winnie","284 words"," Africa News","","",
"Alide Dasnois, Cape Argus (Cape Town)","","","Business and Finance;Health chain set to move into Cape Flats","421 words"," Africa News","","",
"Don Lilford, Cape Argus (Cape Town)","","","Business and Finance;Flying high: Anisha spreads her wings at SAA","1019 words"," Africa News","","",
"Joseph Aranes and Johan Schronen, Cape Argus (Cape Town)","","","South Africa;Bombs re-ignite Flats war","534 words"," Africa News","","",
"Cape Argus (Cape Town)","","","South Africa;Dealing with the 'Groot Krokodil' (Editorial)","288 words"," Africa News","","",
"Thabo Mbaso, Cape Argus (Cape Town)","","","South Africa;BMF takes a tough stand at conference","278 words"," Africa News","","",
"Jenny Viall, Cape Argus (Cape Town)","","","South Africa;Health care languishing in sick bay, says top doc","293 words"," Africa News","","",
"National Party (South Africa)","","","South Africa; From the Leader of the National Party of SA","805 words"," Africa News","","",
"The International Freedom Of Expression Exchange","","","Zimbabwe; Zimbabwe Bill Contravenes And Promotes Freedom Of Expression","240 words"," Africa News","","",
"The International Freedom Of Expression Exchange","","","Africa-at-Large; Article 19 Report Pinpoints State-Sponsored Violence","274 words"," Africa News","","",
"Media Institute of Southern Africa (MISA)","","","Malawi; Alert - MISA Protests Broadcasting Licences In Malawi","561 words"," Africa News","","",
"Media Institute of Southern Africa (MISA)","","","Zambia; Alert - Possible Government Clampdown on The Post","298 words"," Africa News","","",
"UN High Commissioner for Refugees (Geneva)","","","East Africa; Concern About Refugee Explusions in Great Lake Region","555 words"," Africa News","","",
"Joe Kaunda, Post of Zambia (Lusaka)","","","Zambia;Simeza Denied Access To Priscilla","198 words"," Africa News","","",
"Amos Malupenga, Post of Zambia (Lusaka)","","","Zambia;Soldiers To Be Tried Secretly","237 words"," Africa News","","",
"Sam Mujuda, Post of Zambia (Lusaka)","","","Zambia;FTJ Wanted Us Dead, Charges Chongwe","366 words"," Africa News","","",
"Amos Malupenga, Post of Zambia (Lusaka)","","","Zambia;LAZ Reminds Chawinga Of His '81 Coup Detention","1104 words"," Africa News","","",
"Amos Malupenga, Post of Zambia (Lusaka)","","","Zambia;Detained Mwanza Granted Court Hearing","143 words"," Africa News","","",
"Post of Zambia (Lusaka)","","","Zambia;Stop The Rot (Editorial)","1040 words"," Africa News","","",
"Star Radio (Monrovia)","","","Liberia; Liberian Daily News Bulletin","1193 words"," Africa News","","",
"National Party (South Africa)","","","South Africa; Corruption Not Solved By ANC Looking For Blame","392 words"," Africa News","","",
"Western Sahara Referendum Support Association","","","Western Sahara; Declaration of Saharawi Support Conference","790 words"," Africa News","","",
"Rakoro Phororo (Commentary), Mopheme/The Survivor (Maseru)","","","Lesotho;Lesotho Private Sector is Slipping into Sleep","967 words"," Africa News","","",
"Kekeletso Motopi, Mopheme/The Survivor (Maseru)","","","Lesotho;Environment and Social Issues to be Addressed","506 words"," Africa News","","",
"Grace Kobeli, Mopheme/The Survivor (Maseru)","","","Lesotho;Chinese Firms Accused Of Mounting Slavery","529 words"," Africa News","","",
"Grace Kobeli, Mopheme/The Survivor (Maseru)","","","Lesotho;Molopo Replies to Workers","610 words"," Africa News","","",
"Rakoro Phororo (Commentary), Mopheme/The Survivor (Maseru)","","","Lesotho;His Majesty's Philosophy And Unrealistic Expectations","923 words"," Africa News","","",
"World Bank","","","Eritrea;World Bank Approves Ports Rehabilitation Credit For Eritrea","500 words"," Africa News","","",
"United States Information Agency","","","United States and Africa; Clinton And Mali Pres. Konare Hold Talks At White House","270 words"," Africa News","","",
"The East African (Nairobi)","","","Kenya;Moi and Kanu Look Set for a New Victory","2421 words"," Africa News","","",
"The East African (Nairobi)","","","Business and Finance;Kenya Exporters Cry Foul Over High SA Tariffs","845 words"," Africa News","","",
"John Githongo (Commentary), The East African (Nairobi)","","","Kenya;Was It a Nyayo Era or a Nyayo Error?","716 words"," Africa News","","",
"Robert Rweyemamu (Commentary), The East African (Nairobi)","","","Tanzania;Can non Democrats Manage a Democracy?","585 words"," Africa News","","",
"Charles Onyangobbo (Commentary), The East African (Nairobi)","","","East Africa;Tips from Uganda on Winning Elections","673 words"," Africa News","","",
"James Macharia, Special Corespondent, The East African (Nairobi)","","","Business and Finance;Optimism Ahead of Kenyan Election","915 words"," Africa News","","",
"The East African (Nairobi)","","","Tanzania;Dar Police to Issue Statement On Briton's Arrest","803 words"," Africa News","","",
"The East African (Nairobi)","","","Uganda;Uganda Copper Theft Did Take Place - Police","978 words"," Africa News","","",
"Panafrican News Agency","","","Science and Health;Anti-Measles Campaign In Luanda","95 words"," Africa News","","",
"Ghion Hagos, PANA Staff Correspondent, Panafrican News Agency","","","Science and Health;Addis Ababa Vaccinates Most Children Against Polio","388 words"," Africa News","","",
"John Mwaura, PANA Correspondent, Panafrican News Agency","","","Kenya;Rains Havoc Rises Countrywide","372 words"," Africa News","","",
"Nelson Magombo, PANA Correspondent, Panafrican News Agency","","","Malawi;Ailing Banda Flown to South Africa","137 words"," Africa News","","",
"Panafrican News Agency","","","Science and Health;Call For Joint Malaria Control Programme","226 words"," Africa News","","",
"Paul Ejime, PANA Staff Correspondent, Panafrican News Agency","","","Nigeria;OAU Chief, Three Nigerians Win Zik Award","215 words"," Africa News","","",
"Paul Ejime, PANA Staff Correspondent, Panafrican News Agency","","","Nigeria;Abacha Reappoints Three Ministers","141 words"," Africa News","","",
"Panafrican News Agency","","","Science and Health;Uganda To Take Lead In Female Condoms","252 words"," Africa News","","",
"Peter Masebu, PANA Staff Correspondent, Panafrican News Agency","","","Science and Health;Female Circumcision Persists In Africa","619 words"," Africa News","","",
"Panafrican News Agency","","","Ivory Coast;Secondary School Teachers On Strike","112 words"," Africa News","","",
"Panafrican News Agency","","","Southern Africa;Chissano Calls For Boycott Of Unita Sold Diamonds","331 words"," Africa News","","",
"Panafrican News Agency","","","Congo Brazzaville;WFP Hands Out Food To 20,000 Brazzaville Residents","363 words"," Africa News","","",
"Panafrican News Agency","","","Africa-at-Large;Mugabe, Chissano Rally To Kabila's Cause","454 words"," Africa News","","",
"Mildred Mulenga, PANA Staff Correspondent, Panafrican News Agency","","","Zambia;Zambia To Import 100,000 Tonnes Of Maize","173 words"," Africa News","","",
"Panafrican News Agency","","","Tanzania;Tanzania Seeks Investors for Privatised Bank","267 words"," Africa News","","",
"John Mwaura, PANA Correspondent, Panafrican News Agency","","","Science and Health;New Hepatitis Vaccine To Be Launched In Nairobi","323 words"," Africa News","","",
"Panafrican News Agency","","","Angola;President Dos Santos Undergoes Surgical Operation","87 words"," Africa News","","",
"Panafrican News Agency","","","Science and Health;Zimbabwe Abortion Figures Alarming","167 words"," Africa News","","",
"Mildred Mulenga, PANA Staff Correspondent, Panafrican News Agency","","","Africa-at-Large;One Year Lease For Comesa Clearing House","441 words"," Africa News","","",
"Yahya El Hassan, PANA Correspondent, Panafrican News Agency","","","Sudan;Ex-Rebel Sudanese Leader Accuses U.S. Of Sabotaging Talks","408 words"," Africa News","","",
"World Health Organization (Geneva)","","","Science and Health; Cholera in Mozambique","275 words"," Africa News","","",
"Goodson Machona, Post of Zambia (Lusaka)","","","Zambia;There Are No Funds For Chiefs' Palaces","216 words"," Africa News","","",
"Amos Malupenga, Post of Zambia (Lusaka)","","","Zambia;Mung'omba Discharged","315 words"," Africa News","","",
"Goodson Machona, Post of Zambia (Lusaka)","","","Zambia;No Money For Local Government Polls","864 words"," Africa News","","",
"Goodson Machona and Chilombo Mwondela, Post of Zambia (Lusaka)","","","Zambia;Masheke Accuses Chiluba Of Human Rights Violations","1719 words"," Africa News","","",
"Mukalya Nampito and Dickson Jere, Post of Zambia (Lusaka)","","","Zambia;Policemen Steal Medical Report","787 words"," Africa News","","",
"Dickinson Jere, Post of Zambia (Lusaka)","","","Zambia;87 Detained Over Coup","158 words"," Africa News","","",
"Post of Zambia (Lusaka)","","","Zambia;Post Card: Globetrotting","847 words"," Africa News","","",
"Post of Zambia (Lusaka)","","","Zambia;Desperate Behaviour (Editorial)","679 words"," Africa News","","",
"Malik Stan Reaves, Africa News Service","","","Science and Health;Alternative Rite to Female Circumcision Spreading in Kenya","1314 words"," Africa News","","",
"Stephen Muiruri, The Nation (Nairobi)","","","Kenya;Inmate's Dealings Probed","396 words"," Africa News","","",
"Nation Reporter, The Nation (Nairobi)","","","Kenya;Law Society Speaks Out On Lawyers' Suspension","326 words"," Africa News","","",
"The Nation (Nairobi)","","","Africa-at-Large;Terror Threatens To Ground Tourism (Editorial)","367 words"," Africa News","","",
"Nation Team, The Nation (Nairobi)","","","Kenya;Rain Havoc Rises All Round","883 words"," Africa News","","",
"Maguta Kimemia, The Nation (Nairobi)","","","Kenya;Raila Speaks Of Opposition Plan","708 words"," Africa News","","",
"John Yeld, Cape Argus (Cape Town)","","","South Africa;I Was Told To Kill Gugs 7, Says Cop","566 words"," Africa News","","",
"Moses MacKay, Cape Argus (Cape Town)","","","South Africa;Taximen 'Must Pay Protection'","237 words"," Africa News","","",
"Joseph Aranes, Cape Argus (Cape Town)","","","South Africa;Black Woman Angry Over 'Sex Pest'","449 words"," Africa News","","",
"John Yeld, Cape Argus (Cape Town)","","","South Africa;Ntsebeza 'Not Named In Tavern Files'","408 words"," Africa News","","",
"Cape Argus (Cape Town)","","","South Africa;SA Hospitals In Need Of A Transfusion (Editorial)","304 words"," Africa News","","",
"Theo Alant, Cape Argus (Cape Town)","","","South Africa;Wealth Tax 'An Act Of Insanity'","935 words"," Africa News","","",
"Thabo Mabaso, Cape Argus (Cape Town)","","","South Africa;NP Proposals Stall Employment Bill","423 words"," Africa News","","",
"Sabata Ngcai, Cape Argus (Cape Town)","","","South Africa;Funding Plans For Schools Still Under Wraps","153 words"," Africa News","","",
"Joseph Aranes, Cape Argus (Cape Town)","","","South Africa;All Eyes On Kriel Amid Unity Fears","216 words"," Africa News","","",
"Times Reporter, Times of Zambia (Lusaka)","","","Zambia;Rights Commission Incompetent - UNIP","1071 words"," Africa News","","",
"Times Reporter, Times of Zambia (Lusaka)","","","Zambia;Zesco Loses K3 Billion","503 words"," Africa News","","",
"Times Reporter, Times of Zambia (Lusaka)","","","Zambia;Reconciliation Saves Mung'omba","385 words"," Africa News","","",
"Times Reporter, Times of Zambia (Lusaka)","","","Zambia;Attempted Coup Lands 84 In Cells","441 words"," Africa News","","",
"News desk, Times of Zambia (Lusaka)","","","Africa-at-Large;Muslim Fundamentalists Serious Threat To Global Peace (Editorial)","362 words"," Africa News","","",
"Times Reporter, Times of Zambia (Lusaka)","","","Zambia;Rampant Cash Irregularities Deplored","323 words"," Africa News","","",
"Times Reporter, Times of Zambia (Lusaka)","","","Zambia;Secretary Relives Life In Detention","421 words"," Africa News","","",
"Sports Reporter, Times of Zambia (Lusaka)","","","Sports - Soccer;Malawi Under-20 On Preps Tour","262 words"," Africa News","","",
"Business Review Reporter, Times of Zambia (Lusaka)","","","Business and Finance;Hospital Cash Plan Insurance Scheme On","222 words"," Africa News","","",
"Business Review Reporter, Times of Zambia (Lusaka)","","","Zambia;State, UNDP Sign $1.3m Notes On Environmental Aid","421 words"," Africa News","","",
"Business Review Reporter, Times of Zambia (Lusaka)","","","Business and Finance;'Change Science Policies'","350 words"," Africa News","","",
"John Phiri, Political Editor, Times of Zambia (Lusaka)","","","Zambia;ZCCM Privatisation : Let There Be Transparency","1449 words"," Africa News","","",
"Truth and Reconciliation Commission","","","South Africa; Truth Commission Calls 34 for Football Club Hearings","784 words"," Africa News","","",
"African National Congress of South Africa","","","South Africa; ANC Response To Proposals For Reparation","1097 words"," Africa News","","",
"World Food Programme","","","Africa-at-Large; WFP Distributes Food Aid In Brazzaville","437 words"," Africa News","","",
"Star Radio (Monrovia)","","","Liberia; Liberian Daily News Bulletin","1694 words"," Africa News","","",
"New Vision (Kampala)","","","Business and Finance;Clarification on Nov. 4 story","60 words"," Africa News","","",
"Margaret Muhanga, New Vision (Kampala)","","","Uganda;Customs Workers Sent On Leave","244 words"," Africa News","","",
"Simon Kaheru, New Vision (Kampala)","","","Business and Finance;Uganda, Ghana Vie For Supra Electronics","316 words"," Africa News","","",
"Karyeija Kagambirwe, New Vision (Kampala)","","","Business and Finance;Ugandan Environment Body To Check Investors","162 words"," Africa News","","",
"John Kakande, New Vision (Kampala)","","","Uganda;70,000 More To Pay Income Tax","272 words"," Africa News","","",
"Ofwono-Opondo and John Kakande, New Vision (Kampala)","","","Uganda;Speaker Warns MPs","323 words"," Africa News","","",
"Vision Reporter, New Vision (Kampala)","","","Uganda;Museveni To Expose Corruption At Districts","290 words"," Africa News","","",
"Joyce Namutebi, New Vision (Kampala)","","","Uganda;Customs House Rent Cut Nkangi","616 words"," Africa News","","",
"Alfred Wasike, New Vision (Kampala)","","","Uganda;Gen. Tinyefuza Rejects Justice Kanyeihamba","687 words"," Africa News","","",
"Helge Schutz, The Namibian (Windhoek)","","","Namibia;'Nehova Slapped Me'","494 words"," Africa News","","",
"Christof Maletsky, The Namibian (Windhoek)","","","Namibia;White Collar Crime Rising","608 words"," Africa News","","",
"Christof Maletsky, The Namibian (Windhoek)","","","Namibia;White Farmers Set Up Vigilante Roadblocks","351 words"," Africa News","","",
"Helge Schutz, The Namibian (Windhoek)","","","Southern Africa;New Joint Venture To Boost Black Empowerment","380 words"," Africa News","","",
"Chrispin Inambao, The Namibian (Windhoek)","","","Namibia;Illegal Tree Felling 'Could Hit Tourism'","602 words"," Africa News","","",
"Committee to Protect Journalists (CPJ)","","","Nigeria; CPJ Condemns Arrest Of Tell Magazine Editor","870 words"," Africa News","","",
"Amnesty International","","","Algeria; Algeria: Civilians Caught In A Spiral Of Violence","1102 words"," Africa News","","",
"Cape Argus (Cape Town)","","","South Africa;Africa must join global village, says TV chief","1349 words"," Africa News","","",
"Truth and Reconciliation Commission","","","South Africa; Truth Commission to Get Help Locating Ex-Cops","216 words"," Africa News","","",
"International Criminal Tribunal for Rwanda","","","Rwanda; Former Editor Pleads "Not Guilty" To Three Counts","434 words"," Africa News","","",
"United Nations","","","Africa-at-Large; Africa Will Move Into Global Marketplace-SG","481 words"," Africa News","","",
"Panafrican News Agency","","","Africa-at-Large;Dakar To Host Deliberations On International Penal Court","715 words"," Africa News","","",
"Panafrican News Agency","","","Southern Africa;SADC Encouraged To Liberalise Cross-Border Trade","391 words"," Africa News","","",
"Panafrican News Agency","","","Africa-at-Large;Zimbabwe Urges OAU To Fine Tune Organ For Peace","382 words"," Africa News","","",
"Panafrican News Agency","","","Southern Africa;Six Killed As S. African Plane Crashes In Mozambique","263 words"," Africa News","","",
"Panafrican News Agency","","","Science and Health;Mozambican Cholera Death Toll At 131","321 words"," Africa News","","",
"Panafrican News Agency","","","Africa-at-Large;African Debt Trap Eroding Invest Confidence","231 words"," Africa News","","",
"Nelson Magombo, PANA Correspondent, Panafrican News Agency","","","Malawi;Banda's Condition Said To be Improving","158 words"," Africa News","","",
"Nelson Magombo, PANA Correspondent, Panafrican News Agency","","","Africa-at-Large;WFP Establishes El Nino Task Force","221 words"," Africa News","","",
"Ghion Hagos, PANA Staff Correspondent, Panafrican News Agency","","","Rwanda;Ethiopia Proposes Probe Into Rwanda Genocide","288 words"," Africa News","","",
"Panafrican News Agency","","","Ghana;Aliens Being Questioned Over Death Of Police Officer","171 words"," Africa News","","",
"Panafrican News Agency","","","Business and Finance;GSE Share Prices Up","150 words"," Africa News","","",
"Panafrican News Agency","","","Kenya;Government Declares North Eastern Province A Disaster Area","259 words"," Africa News","","",
"United States Information Agency","","","United States and Africa; Mali Seeks Increased U.S. Cooperation Not Aid - Konare","740 words"," Africa News","","",
"Sheikh Chifuwe, Post of Zambia (Lusaka)","","","Sports - Soccer;Nkana's Title Hopes Checked","273 words"," Africa News","","",
"Post of Zambia (Lusaka)","","","Zambia;Credit Africa Bank's Woes (Editorial)","921 words"," Africa News","","",
"Post of Zambia (Lusaka)","","","Zambia;Zambia's Clergy Are No Better Than Prostitutes","1526 words"," Africa News","","",
"Goodson Machona, Post of Zambia (Lusaka)","","","Zambia;SATA Reminded Of His UNIP Past","201 words"," Africa News","","",
"Mukalya Nampito and Chilombo Mwondela, Post of Zambia (Lusaka)","","","Zambia;Presidential Petition: Over 1/2m share NRC numbers","473 words"," Africa News","","",
"Staff Reporter, Post of Zambia (Lusaka)","","","Zambia;Mulenga Mwenso Nabbed For Drugs","264 words"," Africa News","","",
"Goodson Machona, Post of Zambia (Lusaka)","","","Zambia;'Programme Against Malnutrition is not an NGO'","301 words"," Africa News","","",
"Dickson Jere, Post of Zambia (Lusaka)","","","Zambia;Major Kangwa's Medical Report Still With Police","210 words"," Africa News","","",
"Mukalya Nampito, Post of Zambia (Lusaka)","","","Zambia;Detainee Attacks State Advocate","592 words"," Africa News","","",
"Post of Zambia (Lusaka)","","","Zambia;Cooperative Bank To Be Liquidated","287 words"," Africa News","","",
"Joe Kaunda, Post of Zambia (Lusaka)","","","Business and Finance;Citi Bank Limited Launches Customer Relations Initiative","273 words"," Africa News","","",
"Goodson Machona, Post of Zambia (Lusaka)","","","Zambia;Government Advised To Revisit Agricultural Policies","489 words"," Africa News","","",
"Staff Reporter, Post of Zambia (Lusaka)","","","Zambia;Credit Africa Bank Under Drug Enforcement Commission Probe","541 words"," Africa News","","",
"The Nation (Nairobi)","","","Kenya;Build Poll Race On Issues, Not Trivia (Editorial)","362 words"," Africa News","","",
"Nation Team, The Nation (Nairobi)","","","Kenya;Province Declared Disaster Zone","664 words"," Africa News","","",
"Stephen Muiruri, The Nation (Nairobi)","","","Kenya;Top-Level Police Talks On Election","287 words"," Africa News","","",
"Watoro Kamau, The Nation (Nairobi)","","","Kenya;Now Government Drops Koigi Charges","393 words"," Africa News","","",
"Amnesty International","","","Kenya; Forthcoming Elections A Sham Unless Intimidation Stops","521 words"," Africa News","","",
"Amnesty International","","","Egypt; Amnesty Appalled By Mass Killings Of Civilians","335 words"," Africa News","","",
"Amnesty International","","","Algeria; Amnesty: Statement By Pierre Sane, S-G Amnesty International","1574 words"," Africa News","","",
"Action by Churches Together(ACT)","","","Congo Brazzaville; "Terrifying devastation in Brazzaville city"","558 words"," Africa News","","",
"Times Reporter, Times of Zambia (Lusaka)","","","Zambia;Chikamba Censures Executive","468 words"," Africa News","","",
"Times Reporter, Times of Zambia (Lusaka)","","","Zambia;Ignore Kabimba, Urges Saunders","190 words"," Africa News","","",
"Times Reporter, Times of Zambia (Lusaka)","","","Zambia;I Was Accused Of Meeting At The Winas - Detainee","368 words"," Africa News","","",
"Times Reporter, Times of Zambia (Lusaka)","","","Zambia;Over 500,000 NRCs Duplicated","647 words"," Africa News","","",
"Sports Reporter, Times of Zambia (Lusaka)","","","Sports - Soccer;Julio Chiluba Retired","319 words"," Africa News","","",
"Timothy Sichela, Times of Zambia (Lusaka)","","","Sports - General;Boxer Bwalya headed for US","328 words"," Africa News","","",
"Melody Mwala, Times of Zambia (Lusaka)","","","Sports - Soccer;Nkana Lose League Title Race","468 words"," Africa News","","",
"Business Review Reporter, Times of Zambia (Lusaka)","","","Business and Finance;No Inputs On Credit","379 words"," Africa News","","",
"Business Review Reporter, Times of Zambia (Lusaka)","","","Business and Finance;Data Absence Cripples Ceramic Industry","142 words"," Africa News","","",
"Business Review Reporter, Times of Zambia (Lusaka)","","","Business and Finance;Help Us Develop Fish Farming - Minister","290 words"," Africa News","","",
"Business Review Reporter, Times of Zambia (Lusaka)","","","Business and Finance;Tax Evaders Rob Zambia of Millions Of Kwacha","238 words"," Africa News","","",
"Times of Zambia (Lusaka)","","","Zambia;Zambia Urged To Invest In Manpower","242 words"," Africa News","","",
"Times Reporter, Times of Zambia (Lusaka)","","","Zambia;State House Now Goes Internet","361 words"," Africa News","","",
"Times Reporter, Times of Zambia (Lusaka)","","","Zambia;Let's Strengthen Ties, Says Veep","424 words"," Africa News","","",
"Times Reporter, Times of Zambia (Lusaka)","","","Zambia;State, Unions Met To Appoint Conciliator","242 words"," Africa News","","",
"Truth and Reconciliation Commission","","","South Africa; Truth Commission Issues Subpoena for Ex-President","253 words"," Africa News","","",
"Star Radio (Monrovia)","","","Liberia; Liberian Daily News Bulletin","1312 words"," Africa News","","",
"The World Organisation Against Torture (Geneva)","","","Nigeria; Urgent Action Request for Arrested Editor","568 words"," Africa News","","",
