"BYLINE","DATE","DATELINE","HEADLINE","LENGTH","PUBLICATION","SECTION","TITLE",
"World Food Programme","","","Africa-at-Large; WFP Emergency Report No. 45 - Africa","1643 words"," Africa News","","",
"Christof Maletsky, The Namibian (Windhoek)","","","Namibia;Higher Taxes Loom","544 words"," Africa News","","",
"Chrispin Inambao, The Namibian (Windhoek)","","","Namibia;Signature Stalls Project","597 words"," Africa News","","",
"Christof Maletsky, The Namibian (Windhoek)","","","Namibia;Swapo Says Rundu 'Poll Ban' Is 'Unconstitutional'","463 words"," Africa News","","",
"Absalom Shigwedha, The Namibian (Windhoek)","","","Namibia;Ex-Fighter Demos Drag On","320 words"," Africa News","","",
"Oscar Johnson, The Namibian (Windhoek)","","","Namibia;Nujoma Launches Vote Campaign","333 words"," Africa News","","",
"Florence Bamanyaki, All Africa Press Service","","","Science and Health;How Safe Are Menopausal Therapies?","839 words"," Africa News","","",
"All Africa Press Service","","","Africa-at-Large;New Challenges For The African Church In The City","895 words"," Africa News","","",
"APS Correspondent, All Africa Press Service","","","Angola;Angola's UNITA Defiant As UN Implements Sanctions","1275 words"," Africa News","","",
"All Africa Press Service","","","Kenya;Catholic Bishops Caution Kenyans On Elections","460 words"," Africa News","","",
"All Africa Press Service","","","Uganda;Ugandan Graduates Fellowship To Mark 25 Years","433 words"," Africa News","","",
"All Africa Press Service","","","Kenya;Kenyan Parliament Completes Historic Amendments To Constitution","804 words"," Africa News","","",
"All Africa Press Service","","","Sudan;Churches Urge Sudanese Talks Parties To Seek Peace","400 words"," Africa News","","",
"All Africa Press Service","","","Sudan;Sudan In New Spotlight As Us Imposes Embargo","809 words"," Africa News","","",
"All Africa Press Service","","","North Africa;Pope Condemns Violence In Algeria, Air Embargo On Libya","680 words"," Africa News","","",
"All Africa Press Service","","","East Africa;Heavy Floods Continue To Wreak Havoc In Horn, Kenya","591 words"," Africa News","","",
"Cape Argus (Cape Town)","","","South Africa;Sacrificing Phosa To Head Off Winnie (Editorial)","320 words"," Africa News","","",
"Ashley Smith, Cape Argus (Cape Town)","","","South Africa;Police Count Cost Of Pagad's Sea Point Demo","362 words"," Africa News","","",
"Argus Correspondent and Staff Reporters, Cape Argus (Cape Town)","","","South Africa;Prison's Shock Tactics - Electric Fence Plan To Cut Escapes","544 words"," Africa News","","",
"Thabo Mabaso, Cape Argus (Cape Town)","","","South Africa;Cosatu Demands Strong Team To Enforce Jobs Law","492 words"," Africa News","","",
"Johan Schronen and Dennis Cavernelis, Cape Argus (Cape Town)","","","South Africa;Fingerprints: New Scam In Major Cases","378 words"," Africa News","","",
"Lenore Oliver and Haneem Majiet, Cape Argus (Cape Town)","","","Business and Finance;SA Tourism Industry Is Predicting A Bumper Season","268 words"," Africa News","","",
"Ashely Smith, Cape Argus (Cape Town)","","","South Africa;Pagad Silent After Toefy Quits In Rift Over Strategy","227 words"," Africa News","","",
"Johan Schronen, Cape Argus (Cape Town)","","","South Africa;Thin Blue Line Gets Thinner","342 words"," Africa News","","",
"Ethiopian News Agency","","","Ethiopia;The Week in Brief","392 words"," Africa News","","",
"Ethiopian News Agency","","","Ethiopia;Corruption Rife In CARE's Office In Nazareth, Employees Say","227 words"," Africa News","","",
"Ethiopian News Agency","","","Ethiopia;Centenary Of Ethio-Djibouti Railway To Be Observed","182 words"," Africa News","","",
"Derese T/Wolde, Ethiopian News Agency","","","Ethiopia;Private Tannery Inaugurated","368 words"," Africa News","","",
"Asfaw Gemmeda, Ethiopian News Agency","","","Ethiopia;Minister Says Government Endeavors To Develop Information Services","610 words"," Africa News","","",
"Nelson Magombo, PANA Correspondent, Panafrican News Agency","","","Business and Finance;Air Malawi Holds Safety Record","828 words"," Africa News","","",
"Panafrican News Agency","","","Business and Finance;Commonwealth Africa Fund Approves $16-Million For Projects","290 words"," Africa News","","",
"Panafrican News Agency","","","Business and Finance;Kenya Shilling Loses Further Ground","313 words"," Africa News","","",
"Panafrican News Agency","","","Sports - General;Three African Chess Players For World Championships","181 words"," Africa News","","",
"Panafrican News Agency","","","Business and Finance;The Dollar Improves Slightly In Tunis","151 words"," Africa News","","",
"Panafrican News Agency","","","Ghana;Ghana's Economy Not Export-Oriented","281 words"," Africa News","","",
"Panafrican News Agency","","","Sports - General;Zimbabwe Brothers In World Top 100 Tennis Ranking","140 words"," Africa News","","",
"Panafrican News Agency","","","Botswana;Two People Escape Drowning In Gaborone Suburb Stream","317 words"," Africa News","","",
"John Mwaura, PANA Correspondent, Panafrican News Agency","","","Kenya;Mixed Reactions In Kenya To Dissolution Of Parliament","328 words"," Africa News","","",
"Panafrican News Agency","","","Business and Finance;Drab Trading On Ghana Stock Exchange","281 words"," Africa News","","",
"Panafrican News Agency","","","Kenya;Local Sugar Importers Cry Foul","296 words"," Africa News","","",
"John Mwaura, PANA Correspondent, Panafrican News Agency","","","Kenya;Kenya Announces Measures To Curb Spending","391 words"," Africa News","","",
"Jogn Mwaura, PANA Correspondent, Panafrican News Agency","","","Sudan;Sudanese Peace Talks Postponed to April","427 words"," Africa News","","",
"Paul Ejime, PANA Staff Correspondent, Panafrican News Agency","","","Nigeria;11 Persons Reported Dead In Market Fire","287 words"," Africa News","","",
"Paul Okolo, PANA Correspondent, Panafrican News Agency","","","Business and Finance;Bearish Sentiments Still Rule Nigerian Stock Market","353 words"," Africa News","","",
"Tepitapia Sannah, PANA Correspondent, Panafrican News Agency","","","Liberia;Liberia-ECOMOG Tussle Over Restructuring Of The Army","652 words"," Africa News","","",
"Panafrican News Agency","","","Congo Brazzaville;UN Seeks 17.7 Million Dollars Emergency Assistance For Congo","364 words"," Africa News","","",
"Panafrican News Agency","","","Zimbabwe;Sithole Trial To Resume On November 24","234 words"," Africa News","","",
"Panafrican News Agency","","","Business and Finance;CFA Franc Strengthens As Cedi and Kenya Shilling Decline","373 words"," Africa News","","",
"Panafrican News Agency","","","Tanzania;Thousands Axed From Government Service","258 words"," Africa News","","",
"Panafrican News Agency","","","Botswana;Bureaucratic Bottlenecks Stifling Tourism In Botswana","165 words"," Africa News","","",
"Star Radio (Monrovia)","","","Liberia; Liberian Daily News Bulletin","1547 words"," Africa News","","",
"Frederick Nyakabwa, New Vision (Kampala)","","","Uganda;ADF Kills 8 In Kabarole","186 words"," Africa News","","",
"Simon Peter Ekarot and Namayo Mawerere, New Vision (Kampala)","","","Uganda;Namboole To Open Jan 26","241 words"," Africa News","","",
"Edith Kimuli and Hillary Nsambu, New Vision (Kampala)","","","Uganda;Danze, URA Disagree On How To Sell Goods","345 words"," Africa News","","",
"New Vision (Kampala)","","","Uganda;Declare All Assets! (Editorial)","516 words"," Africa News","","",
"Ndyakira Amooti, New Vision (Kampala)","","","Uganda;Ugandans Warned Of Imminent Floods","169 words"," Africa News","","",
"Justin Moro, New Vision (Kampala)","","","Uganda;Army Kills Eight Kony Rebels","389 words"," Africa News","","",
"Alfred Wasike, New Vision (Kampala)","","","Uganda;Movement Caucus To 'Meet Over Muhwezi'","184 words"," Africa News","","",
"Alfred Wasike, New Vision (Kampala)","","","Uganda;Moses Ali Denies UWA Loan","359 words"," Africa News","","",
"Yunusu Abbey and Edith Kimuli, New Vision (Kampala)","","","Uganda;Airlines Engineer Held On Terrorism","323 words"," Africa News","","",
"Emmy Allio, New Vision (Kampala)","","","Uganda;Mao Wants House Corruption Committee","228 words"," Africa News","","",
"The Nation (Nairobi)","","","Business and Finance;Stockbrokers And KBL Rights Shares (Editorial)","379 words"," Africa News","","",
"The Nation (Nairobi)","","","Kenya;Now Is The Time To Be Level-Headed (Editorial)","403 words"," Africa News","","",
"Kariuki Waihenya, The Nation (Nairobi)","","","Business and Finance;In Kenya Inflation Abates As Shilling Rises","378 words"," Africa News","","",
"Nation Team, The Nation (Nairobi)","","","Kenya;All clear for Election '97","1075 words"," Africa News","","",
"Dumisane Lubisi, African Eye News Service (South Africa)","","","South Africa;Mpumalanga Announces 10-Point Plan To Reform Tender Procedures","592 words"," Africa News","","",
"Dumisane Lubisi, African Eye News Service (South Africa)","","","South Africa;Mpumalanga Provincial Capital Gets Wired","308 words"," Africa News","","",
"Justin Arenstein, African Eye News Service (South Africa)","","","South Africa;Irregularities Costs Towns Millions In Cancelled Developments","716 words"," Africa News","","",
"Dumisane Lubisi, African Eye News Service (South Africa)","","","South Africa;Opposition Parties Rejoin Highveld Ridge Council","307 words"," Africa News","","",
"Leonard Ndzhukula & Justin Arenstein, African Eye News Service (South Africa)","","","South Africa;Former Police Commissioner, Three Others In Court For Fraud","293 words"," Africa News","","",
"Justin Arenstein, African Eye News Service (South Africa)","","","Southern Africa;Phosa In Mozambique To Punt Resettlement Of SA Farmers","167 words"," Africa News","","",
"Chilombo Mwondela, Post of Zambia (Lusaka)","","","Business and Finance;COMESA Urged To Move With Time","369 words"," Africa News","","",
"Chilombo Mwondela, Post of Zambia (Lusaka)","","","Zambia;Monitor Public Opinion","726 words"," Africa News","","",
"Reuben Phiri and Joe Kaunda, Post of Zambia (Lusaka)","","","Zambia;Simpson Defends ZNBC Personnel","170 words"," Africa News","","",
"Joe Kaunda and Reuben Phiri, Post of Zambia (Lusaka)","","","Zambia;Kaunda Warns Of Upheaval","303 words"," Africa News","","",
"Post of Zambia (Lusaka)","","","Zambia;Chiluba's Secret Detentions (Editorial)","677 words"," Africa News","","",
"Goodson Machona, Post of Zambia (Lusaka)","","","Zambia;Chiluba Warned Of Another Coup","372 words"," Africa News","","",
"Dickson Jere, Post of Zambia (Lusaka)","","","Zambia;Pastor Mumba Advises Government Against Repression","701 words"," Africa News","","",
"Reuben Phiri, Post of Zambia (Lusaka)","","","Zambia;Uphold Ethics, Makayi Tells Government Media Heads","251 words"," Africa News","","",
"Reuben Phiri and Joe Kaunda, Post of Zambia (Lusaka)","","","Swaziland;ZIMA Opposes Swaziland's Media Council Bill","250 words"," Africa News","","",
"Mukalya Nampito, Post of Zambia (Lusaka)","","","Zambia;Chiluba Emphasises Separation Of Powers","263 words"," Africa News","","",
"Times of Zambia (Lusaka)","","","Business and Finance;Law Association of Zambia's War On Banks Should Continue","181 words"," Africa News","","",
"Business desk, Times of Zambia (Lusaka)","","","Business and Finance;Road Rehabilitation: Look Beyond City Limits","289 words"," Africa News","","",
"Business Review Reporter, Times of Zambia (Lusaka)","","","Business and Finance;Redefine Comesa Clearing House","410 words"," Africa News","","",
"Business Review Reporter, Times of Zambia (Lusaka)","","","Business and Finance;Firm Pumps K150m Into Horns Export","157 words"," Africa News","","",
"Business Review Reporter, Times of Zambia (Lusaka)","","","Business and Finance;Develop Tourism Siavonga Council Advised","317 words"," Africa News","","",
"Yohanne Kamanga, Times of Zambia (Lusaka)","","","Science and Health;Anti-AIDS Drive Seems To Have Lost Steam","2070 words"," Africa News","","",
"Yuyo Kambikambi, Times of Zambia (Lusaka)","","","Sports - Soccer;Ministry Taken To Task","337 words"," Africa News","","",
"Sports Reporter, Times of Zambia (Lusaka)","","","Sports - General;Satwant Won't Quit","171 words"," Africa News","","",
"Times Reporter, Times of Zambia (Lusaka)","","","Zambia;Zamtel Accounts Wing In A Mess","241 words"," Africa News","","",
"Times Reporter, Times of Zambia (Lusaka)","","","Zambia;Legal Advice Pillar Of Democracy - Chiluba","482 words"," Africa News","","",
"Times Reporter, Times of Zambia (Lusaka)","","","Zambia;NCC Nods State Of Emergency","688 words"," Africa News","","",
"News desk, Times of Zambia (Lusaka)","","","Zambia;Inter-Church Warfare (Editorial)","418 words"," Africa News","","",
"Times Reporter, Times of Zambia (Lusaka)","","","Zambia;'You Are Up To No Good'","357 words"," Africa News","","",
"Tabby Moyo, The Namibian (Windhoek)","","","Business and Finance;Growth In Namibian Exports Predicted","422 words"," Africa News","","",
"Oscar Johnson, The Namibian (Windhoek)","","","Namibia;Public Say On Epupa Extended","473 words"," Africa News","","",
"Ka'ki Ocansey, Mopheme/The Survivor (Maseru)","","","Lesotho;Environment Fair 97 - What Went Wrong?","437 words"," Africa News","","",
"Mopheme/The Survivor (Maseru)","","","Lesotho;LTC Workers Appeal Expulsion","171 words"," Africa News","","",
"Kekeletso Motopi, Mopheme/The Survivor (Maseru)","","","Lesotho;Doctor Moore Credibility On Challenge","391 words"," Africa News","","",
"Khutliso Sekoati, Mopheme/The Survivor (Maseru)","","","Lesotho;Ministers Named In LHDA Scam","789 words"," Africa News","","",
"Khutliso Sekoati, Mopheme/The Survivor (Maseru)","","","Lesotho;Deaths Reveal No Safety Precautions at Construction Industry","647 words"," Africa News","","",
"Ashely Smith and Jermaine Craig, Cape Argus (Cape Town)","","","South Africa;Future Of Parliament Could Hinge On Tutu Snub","314 words"," Africa News","","",
"Ashley Smith, Cape Argus (Cape Town)","","","South Africa;Leaders Take Credit As Nats Support Freedom For Tutu","294 words"," Africa News","","",
"Jermaine Craig, Cape Argus (Cape Town)","","","South Africa;You're A Wonderful Bunch Of People, Freeman Tutu Tells Capetonians","233 words"," Africa News","","",
"Staff Reporter, Cape Argus (Cape Town)","","","South Africa;It Was All The Media's Fault, Says Markovitz","212 words"," Africa News","","",
"Ashley Smith, Cape Argus (Cape Town)","","","South Africa;Regret, Stirring Tributes And Emotional Apologies","260 words"," Africa News","","",
"Thabo Mabaso, Cape Argus (Cape Town)","","","Business and Finance;Cape Town Company's Deal With China Sealed Today","356 words"," Africa News","","",
"Cape Argus (Cape Town)","","","South Africa;Stop The Brain Drain Before It's Too Late (Editorial)","294 words"," Africa News","","",
"Sharkey Isaacs, Cape Argus (Cape Town)","","","South Africa;Muslim Summit Sets Up Security Probe","133 words"," Africa News","","",
"Jermaine Craig and Ashely Smith, Cape Argus (Cape Town)","","","South Africa;At Last! 'The Arch' Has Freedom Of City","359 words"," Africa News","","",
"Ghana Focus (Accra)","","","Ghana;Anglican Bishop Favours Ordination Of Women","309 words"," Africa News","","",
"Ethiopian News Agency","","","Ethiopia;State Government Rescues 200 Trapped By Flooding","477 words"," Africa News","","",
"Ethiopian News Agency","","","Business and Finance;British Businessmen Keen To Work With Counterparts In Ethiopia","189 words"," Africa News","","",
"Ethiopian News Agency","","","Ethiopia;Court Hears Charges Against Major Kassaye Aragaw, Others","296 words"," Africa News","","",
"Ethiopian News Agency","","","Ethiopia;Conference Approves City Administration Charter","359 words"," Africa News","","",
"Panafrican News Agency","","","United States and Africa;U.S. Boosts Trade With Africa","754 words"," Africa News","","",
"Panafrican News Agency","","","Uganda;Uganda Police Get Curt Order: No More Fancy Hair Styles","294 words"," Africa News","","",
"Panafrican News Agency","","","Science and Health;Africa Records Significant Fall In Infant Mortality","231 words"," Africa News","","",
"Panafrican News Agency","","","Science and Health;Religious and Cultural Beliefs Slated Over AIDS In Botswana","263 words"," Africa News","","",
"Panafrican News Agency","","","Science and Health;Muslim Leaders Spell Out Conditions For Condom Use","238 words"," Africa News","","",
"Panafrican News Agency","","","Kenya;Kenya Parliamentary Seats Declared Vacant","197 words"," Africa News","","",
"Panafrican News Agency","","","Science and Health;Accra To Host Meeting On Animal Trypanosomiasis","337 words"," Africa News","","",
"Panafrican News Agency","","","Central Africa;Congo Seeks Extradition of Zambian Cable Thieves","321 words"," Africa News","","",
"Panafrican News Agency","","","Science and Health;Mining-related Respiratory Diseases Rampant In Zambia","227 words"," Africa News","","",
"Musengwa Kayaya, PANA Staff Correspondent, Panafrican News Agency","","","Science and Health;Zambian Doctor Warns Of Impending Diabetes Epidemic","556 words"," Africa News","","",
"Ghion Hagos, PANA Staff Correspondent, Panafrican News Agency","","","Africa-at-Large;UNESCO Official On Harnessing Information For Development","390 words"," Africa News","","",
"Mildred Mulenga, PANA Staff Correspondent, Panafrican News Agency","","","Central Africa;Zambia To Import Power From Congo","369 words"," Africa News","","",
"Mildred Mulenga, PANA Staff Correspondent, Panafrican News Agency","","","Zambia;Zambia Rules Out Foreign Intervention In Political Crisis","574 words"," Africa News","","",
"Panafrican News Agency","","","Business and Finance;Zimbabwe Stock Exchange Performance Improves","156 words"," Africa News","","",
"Panafrican News Agency","","","Business and Finance;Zimbabwe Burley Tobacco Attracting Overseas Interest","319 words"," Africa News","","",
"Panafrican News Agency","","","Somalia;U.N. Appeals For Aid To Somali Flood Victims","367 words"," Africa News","","",
"John Mwaura, PANA Correspondent, Panafrican News Agency","","","Kenya;Kenya General Elections In December","258 words"," Africa News","","",
"Peter Masebu, PANA Staff Correspondent, Panafrican News Agency","","","Science and Health;Urban-Based Africans Prone To Diabetes","798 words"," Africa News","","",
"Panafrican News Agency","","","Business and Finance;GSE Makes Strong Rally","306 words"," Africa News","","",
"Panafrican News Agency","","","Africa-at-Large;Food Shortages Grip 18 African Countries","180 words"," Africa News","","",
"Star Radio (Monrovia)","","","Liberia; Liberian Daily News Bulletin","2016 words"," Africa News","","",
"Times of Zambia (Lusaka)","","","Zambia;Leave Us Out Emergency Talk - Norway Ambassador","326 words"," Africa News","","",
"Caesar Jere, Times of Zambia (Lusaka)","","","Arts and Entertainment;African Film Makers Come Of Age","1881 words"," Africa News","","",
"Yuyo Kambikamabi, Times of Zambia (Lusaka)","","","Sports - Soccer;Chiluba Advises FAZ","279 words"," Africa News","","",
"Business Review Reporter, Times of Zambia (Lusaka)","","","Business and Finance;Zambian Province Welcomes Wood Industries","277 words"," Africa News","","",
"Business Review Reporter, Times of Zambia (Lusaka)","","","Business and Finance;Bus Operators Hike Fares In Kitwe?","217 words"," Africa News","","",
"A Correspondent, Times of Zambia (Lusaka)","","","Business and Finance;Zambia's Liberty Biscuits Plans Ahead","166 words"," Africa News","","",
"Business Review Reporter, Times of Zambia (Lusaka)","","","Business and Finance;US, Argentina Raise Maize Prices","377 words"," Africa News","","",
"Business Review Reporter, Times of Zambia (Lusaka)","","","Business and Finance;Zambian Milling Firm To Spend $25 Million","227 words"," Africa News","","",
"Business Review Reporter, Times of Zambia (Lusaka)","","","Business and Finance;Zambia Industrial Partnership Council Launched","287 words"," Africa News","","",
"Times Reporter, Times of Zambia (Lusaka)","","","Science and Health;Zambia Minister Hails Council for Scientific Research Progress","505 words"," Africa News","","",
"Times Reporter, Times of Zambia (Lusaka)","","","Zambia;Attacks On Minister Worry ZCTU","312 words"," Africa News","","",
"Times Reporter, Times of Zambia (Lusaka)","","","Zambia;No DNA Test - Court","473 words"," Africa News","","",
"Times Reporter, Times of Zambia (Lusaka)","","","Zambia;American White Maize Coming","624 words"," Africa News","","",
"Times of Zambia (Lusaka)","","","Zambia;UNHCR To Trim Budget","150 words"," Africa News","","",
"Times Reporter, Times of Zambia (Lusaka)","","","Zambia;Kaunda Back In December","488 words"," Africa News","","",
"Staff Reporter, Post of Zambia (Lusaka)","","","Zambia;Azwell Seeks Mugabe's Help","1244 words"," Africa News","","",
"Staff Reporter, Post of Zambia (Lusaka)","","","Zambia;Major Kangwa In Court Today","149 words"," Africa News","","",
"Goodson Machona, Chilombo Mwondela and Mukalya Nampito, Post of Zambia (Lusaka)","","","Zambia;DNA Test Ruled Out","698 words"," Africa News","","",
"Post of Zambia (Lusaka)","","","Africa-at-Large;Leadership Crisis (Editorial)","658 words"," Africa News","","",
"Joseph Olanyo, New Vision (Kampala)","","","Business and Finance;In Uganda Public Accounting To Change","215 words"," Africa News","","",
"Betty Businge, New Vision (Kampala)","","","Business and Finance;Thomas Cook Ltd Offers Quick Global Cash Transfers","196 words"," Africa News","","",
"New Vision (Kampala)","","","Business and Finance;Uganda: Westmont Team Due Next Week","339 words"," Africa News","","",
"Nathan Etengu, New Vision (Kampala)","","","Business and Finance;Biscuit Plant For Mbale, Uganda","199 words"," Africa News","","",
"John Odyek, New Vision (Kampala)","","","Business and Finance;Ugandan Coffee Exports Decline","278 words"," Africa News","","",
"Edith Kimuli, New Vision (Kampala)","","","Uganda;Man Held In Tourist Bombing","169 words"," Africa News","","",
"Vision Reporter, New Vision (Kampala)","","","Business and Finance;Museveni Opens Factory In Luweero","237 words"," Africa News","","",
"Alfred Wasike, New Vision (Kampala)","","","Uganda;Court Registrar Raps NPART On 'Missing Files'","408 words"," Africa News","","",
"Anne Mugisa and Milton Olupot, New Vision (Kampala)","","","Uganda;Security Chiefs To Face PAC","346 words"," Africa News","","",
"J.B. Wasswa and Anne Mugisa, New Vision (Kampala)","","","Uganda;Kigongo Refutes Caucus Meeting","237 words"," Africa News","","",
"Ofwono-Opondo and Richard Mutumba, New Vision (Kampala)","","","Uganda;Premier, Ministers Cleared","352 words"," Africa News","","",
"Odrek Rwabwogo, New Vision (Kampala)","","","Uganda;Customs House: MPs Demand Title","370 words"," Africa News","","",
"Chrispin Inambao, The Namibian (Windhoek)","","","Namibia;Death Of Caprivi Correspondent Sparks Furore","594 words"," Africa News","","",
"Tabby Moyo, The Namibian (Windhoek)","","","Southern Africa;SA-EU Trade Pact Set For Mid-98","573 words"," Africa News","","",
"Helge Schutz, The Namibian (Windhoek)","","","Namibia;Opposition Slams Additional Budget","495 words"," Africa News","","",
"Oscar Johnson, The Namibian (Windhoek)","","","Namibia;Namibia Disputes Poaching Claims","575 words"," Africa News","","",
"Tabby Moyo, The Namibian (Windhoek)","","","Namibia;Losses Ground New Plane Plans","486 words"," Africa News","","",
"Tabby Moyo, The Namibian (Windhoek)","","","Namibia;NBC Accused Of Hidden Poll Agenda","367 words"," Africa News","","",
"Conrad Angula, The Namibian (Windhoek)","","","Sports - Soccer;Cosafa Tourney Hangs In Balance","499 words"," Africa News","","",
"Nation Correspondent, The Nation (Nairobi)","","","Kenya;I'm Keeping My Options Open - Koigi","320 words"," Africa News","","",
"Nation Reporter, The Nation (Nairobi)","","","Kenya;Ngilu Records Statement Over Clashes Claim","532 words"," Africa News","","",
"Edmund Kwena, The Nation (Nairobi)","","","Kenya;Moi Dissolved Parliament In Feared Of Impeachment - Wamalwa","316 words"," Africa News","","",
"Kathlen Openda, The Nation (Nairobi)","","","Kenya;National Convention Assembly Converts to Constituent Assembly","375 words"," Africa News","","",
"The Nation (Nairobi)","","","Sudan;Negotiations Best Option For Sudan (Editorial)","379 words"," Africa News","","",
"Stephen Muiruri, The Nation (Nairobi)","","","Kenya;Matiba Says He'll Storm State House","434 words"," Africa News","","",
"The Nation (Nairobi)","","","Kenya;Seven ex-MPs Desert Ford-K","812 words"," Africa News","","",
"Sabata Ngcai, Cape Argus (Cape Town)","","","South Africa;UCT's Historic Language Merger","324 words"," Africa News","","",
"Cape Argus (Cape Town)","","","South Africa;Cape Town's Honour (Leader)","308 words"," Africa News","","",
"Sabata Ngcai, Cape Argus (Cape Town)","","","South Africa;We'll Co-Operate But We Won't Unite, Say Other Universities","251 words"," Africa News","","",
"Llewellyn Jones, Cape Argus (Cape Town)","","","South Africa;Economic Empowerment 'Vital For The Western Cape'","377 words"," Africa News","","",
"Banele Ginindza, African Eye News Service (South Africa)","","","Business and Finance;Foot & Mouth Scare In Swaziland","323 words"," Africa News","","",
"Dumisane Lubisi, African Eye News Service (South Africa)","","","South Africa;New Multi-Million Rand Dam, Houses And Stadium For Balfour","246 words"," Africa News","","",
"Sharon Hammond, African Eye News Service (South Africa)","","","South Africa;AWOL Lions To Be Captured For New Game Reserve","332 words"," Africa News","","",
"Leonard Ndzhukula & Justin Arenstein, African Eye News Service (South Africa)","","","South Africa;Police Appeal For Help On Probes Into Assaults On Journalists","423 words"," Africa News","","",
