"BYLINE","DATE","DATELINE","HEADLINE","LENGTH","PUBLICATION","SECTION","TITLE",
"Panafrican News Agency","","","Somalia;Somali Floods Leave More Than 2,000 Dead","211 words"," Africa News","","",
"Innocent Gore, PANA Correspondent, Panafrican News Agency","","","Africa-at-Large;EU Issues Green Paper On Lome Convention","996 words"," Africa News","","",
"Panafrican News Agency","","","Kenya;Presidential Aspirant Quits","212 words"," Africa News","","",
"African National Congress of South Africa","","","South Africa; ANS Says Alliance Remains Pillar of National Liberation","1153 words"," Africa News","","",
"Front for National Liberation in Burundi","","","Burundi; Spokesman Says Military Struggle to Resume in Burundi","760 words"," Africa News","","",
"Star Radio (Monrovia)","","","Liberia; Liberian Daily News Bulletin","1656 words"," Africa News","","",
"Paul Busharizi, New Vision (Kampala)","","","Business and Finance;Sabena, Delta Airlines In Joint Flight Scheme","248 words"," Africa News","","",
"Lawrence Wamanga, New Vision (Kampala)","","","Uganda;MP's Get Thumbs-Up On Income Tax Bill","197 words"," Africa News","","",
"Betty Kagoro, New Vision (Kampala)","","","Business and Finance;Uganda Government Launches Meat Project","267 words"," Africa News","","",
"Eric Lakidi, New Vision (Kampala)","","","Uganda;Kitgum Security Up","435 words"," Africa News","","",
"Yunusu Abbey, New Vision (Kampala)","","","Uganda;'No Moi Shares In UCB'","271 words"," Africa News","","",
"New Vision (Kampala)","","","Uganda;Youth Arrive For Crisis Meet","273 words"," Africa News","","",
"Vision Reporter, New Vision (Kampala)","","","Uganda;Uganda Wildlife Authority Wants Edroma Prosecuted","425 words"," Africa News","","",
"Henry Tumwine, New Vision (Kampala)","","","Uganda;Fresh Wrangles In UPC","326 words"," Africa News","","",
"Patrick Luganda, New Vision (Kampala)","","","Uganda;Rains Kill 7","320 words"," Africa News","","",
"Alfred Wasike, New Vision (Kampala)","","","Uganda;Tinyefuza Case: Museveni Role' Puzzles Lawyers","569 words"," Africa News","","",
"Justus Koini And Joseph Saronge, The Nation (Nairobi)","","","Kenya;12 killed in tribal fighting","548 words"," Africa News","","",
"Nation Team, The Nation (Nairobi)","","","Kenya;Kanu polls row spreads","466 words"," Africa News","","",
"Vincent Mwangi, The Nation (Nairobi)","","","Kenya;Man freed from murder conviction","516 words"," Africa News","","",
"Eric Slimoli, The Nation (Nairobi)","","","Kenya;All-party team on KBC","674 words"," Africa News","","",
"Paul Redfern, The Nation (Nairobi)","","","Kenya;Sh96m grant for poll monitoring","661 words"," Africa News","","",
"Panafrican News Agency","","","Zimbabwe;Bulawayo Gets First Locally Born Catholic Bishop","207 words"," Africa News","","",
"Bouazza Ben Bouazza, PANA Correspondent, Panafrican News Agency","","","Sports - Soccer;E.S. Sahel 2, FAR 0 In African Cup Winners' Cup First Leg Game","114 words"," Africa News","","",
"Panafrican News Agency","","","Southern Africa;Southern African Women's Expo A Flop, Say Exhibitors","257 words"," Africa News","","",
"Panafrican News Agency","","","Sports - General;Jean-Claude Nganga Re-elected To Head African Olympic Body","120 words"," Africa News","","",
"Newton Kanhema, PANA Correspondent, Panafrican News Agency","","","South Africa;Winnie Madikizela-Mandela "Football Club" Again Under Spotlight","585 words"," Africa News","","",
"Ghion Hagos, PANA Staff Correspondent, Panafrican News Agency","","","Ethiopia;Italian President Arrives In Addis Ababa On Four-Day Visit","440 words"," Africa News","","",
"Sharon Hammond, African Eye News Service (South Africa)","","","South Africa;MEC promises to work harder after "unkind" press coverage","229 words"," Africa News","","",
"Sharon Hammond, African Eye News Service (South Africa)","","","South Africa;National Parks Board undergoes name change","193 words"," Africa News","","",
"John Hammond, African Eye News Service (South Africa)","","","South Africa;Civil servants paid after six months of no salaries","181 words"," Africa News","","",
"Sharon Hammond, African Eye News Service (South Africa)","","","South Africa;Nudist colony to bare all in Nelspruit","445 words"," Africa News","","",
"Star Radio (Monrovia)","","","Liberia; Liberian Daily News Bulletin","1154 words"," Africa News","","",
"Anne A. Mugisa, New Vision (Kampala)","","","Uganda;'L. Albert Boat Not Licensed'","215 words"," Africa News","","",
"Betty Businge, New Vision (Kampala)","","","Uganda;Kazibwe Advises Women MPs","122 words"," Africa News","","",
"Davis Joseph Weddi, New Vision (Kampala)","","","Uganda;Water Crisis Hits Nakawa","217 words"," Africa News","","",
"Nathan Etengu, New Vision (Kampala)","","","Uganda;Twenty Killed In Mbale Landslide","162 words"," Africa News","","",
"Edson Bagada, New Vision (Kampala)","","","Uganda;Reinstate Karazarwe, Orders Otafiire","429 words"," Africa News","","",
"Vision Reporter, New Vision (Kampala)","","","Uganda;Sh400m Deal Awarded Quietly","623 words"," Africa News","","",
"Vision Reporter, New Vision (Kampala)","","","Uganda;I Will Declare My Wealth --Muhwezi","155 words"," Africa News","","",
"Andrew Ngwiri, The Nation (Nairobi)","","","Kenya;Security For Top Contenders Is A Smart Move","1152 words"," Africa News","","",
"Wahome Mutahi, The Nation (Nairobi)","","","Kenya;KBC needs new ideas to give fair coverage","1405 words"," Africa News","","",
"Peter Kimani, The Nation (Nairobi)","","","Kenya;Disaster That Came From Above","1265 words"," Africa News","","",
"Gitau Warigi, The Nation (Nairobi)","","","Kenya;Is the Party Finally Over For Matiba?","971 words"," Africa News","","",
"Kwendo Opanga, The Nation (Nairobi)","","","Kenya;'This Time Round There are 22 Parties and 14 Presidential Hopefuls'","1720 words"," Africa News","","",
"Peter Kimani, The Nation (Nairobi)","","","Kenya;Keeping Mo's Dream Alive and Working","1085 words"," Africa News","","",
"Philip Ochieng, The Nation (Nairobi)","","","Kenya;Of politicians and The Issue At Hand","1044 words"," Africa News","","",
"The Nation (Nairobi)","","","Kenya;Take This Grave Matter Seriously (Editorial)","1139 words"," Africa News","","",
"Mutuma Mathiu And Adonia Ayebare, The Nation (Nairobi)","","","Rwanda;Kagame Represents A New Generation of Rebel-Politicians","1762 words"," Africa News","","",
"Oliver Musembi And Maguta Kimemia, The Nation (Nairobi)","","","Kenya;Matiba men fail in party search","464 words"," Africa News","","",
"i'Afrika News Network (Copenhagen)","","","Sports - Soccer;Zimbabwe fails to pay soccer coach","240 words"," Africa News","","",
"i'Afrika News Network (Copenhagen)","","","Zimbabwe;Zimbabwe News Roundup","2346 words"," Africa News","","",
"i'Afrika News Network (Copenhagen)","","","Zimbabwe;Churches: Morality Key To Aids Prevention","1030 words"," Africa News","","",
"i'Afrika News Network (Copenhagen)","","","Tanzania;Tanzania News Roundup","2764 words"," Africa News","","",
"i'Afrika News Network (Copenhagen)","","","Tanzania;Gambling: A Path Along The Investment Avenue","587 words"," Africa News","","",
"i'Afrika News Network (Copenhagen)","","","Malawi;Malawi News Roundup","3257 words"," Africa News","","",
"i'Afrika News Network (Copenhagen)","","","Malawi;Power, water cuts become order of the day","562 words"," Africa News","","",
"UN High Commissioner for Refugees (Geneva)","","","Liberia; Voluntary Repatriation To Liberia: More Refugees Go Home","388 words"," Africa News","","",
"i'Afrika News Network (Copenhagen)","","","Angola;Angola News Roundup","2275 words"," Africa News","","",
"i'Afrika News Network (Copenhagen)","","","Angola;After 7 Years Santos And Savimbi: Finally In Luanda","872 words"," Africa News","","",
"Committee to Protect Journalists (CPJ)","","","Nigeria; Letter Protesting Arrests of Nigerian Journalists","609 words"," Africa News","","",
"Star Radio (Monrovia)","","","Liberia; Liberian Daily News Bulletin","954 words"," Africa News","","",
"The International Freedom Of Expression Exchange","","","Nigeria; European Union to weaken Nigeria position","401 words"," Africa News","","",
"Amnesty International","","","Kenya; Amnesty Appeals To Candidates","269 words"," Africa News","","",
"United Nations","","","Africa-at-Large; 40 African Countries Meet In Dakar To Discuss Environment","284 words"," Africa News","","",
"United Nations","","","Africa-at-Large; Food Emergencies Persist In 20 African Countries, FAO","715 words"," Africa News","","",
"United Nations","","","Tunisia; Tunisia Representative's speech to General Assembly","257 words"," Africa News","","",
"United Nations","","","Benin; Benin Representative's Speech to General Assembly","192 words"," Africa News","","",
"United Nations","","","Malawi; Malawi Representative's Speech to General Assembly","189 words"," Africa News","","",
"United Nations","","","Ethiopia; Ethiopian Representative's Speech to General Assembly","268 words"," Africa News","","",
"United Nations","","","Swaziland; Swaziland Representative's Speech to GA about OAU","362 words"," Africa News","","",
"United Nations","","","Africa-at-Large; OAU Representative's Speech to UN General Assembly","391 words"," Africa News","","",
"United Nations","","","Burundi; Assistance for Burundi: draft resolution","222 words"," Africa News","","",
"United Nations","","","Sudan; Emergency Assistance to the Sudan","341 words"," Africa News","","",
"United Nations","","","Rwanda; Assistance to Rwanda","390 words"," Africa News","","",
"United Nations","","","Somalia; Economic and Social Rehabilitation of Somalia","398 words"," Africa News","","",
"United Nations","","","Djibouti; Reconstruction and Development of Djibouti","308 words"," Africa News","","",
"United Nations","","","Liberia; Rehabilitation and Reconstruction of Liberia","299 words"," Africa News","","",
"United Nations","","","Madagascar; Reconstruction of Madagascar After Natural Disasters","221 words"," Africa News","","",
"United Nations","","","Angola; Economic Rehabilitation of Angola","386 words"," Africa News","","",
"United Nations","","","Congo Kinshasa; Democratic Republic of the Congo: draft resolution","345 words"," Africa News","","",
"United Nations","","","Africa-at-Large; Assembly Seeks Closer Ties Between UN, OAU","850 words"," Africa News","","",
"Panafrican News Agency","","","Science and Health;United Nations Sets Up Task Force On El Nino","332 words"," Africa News","","",
"Panafrican News Agency","","","East Africa;East Africans Plan To Harmonise Tariffs","384 words"," Africa News","","",
"Mildred Mulenga, PANA Staff Correspondent, Panafrican News Agency","","","East Africa;Comesa Urged To Attract Foreign Direct Investment","559 words"," Africa News","","",
"Newton Kanhema, PANA Correspondent, Panafrican News Agency","","","South Africa;Katiza Cebekhulu arrives in South Africa","191 words"," Africa News","","",
"Ghion Hagos, PANA Staff Correspondent, Panafrican News Agency","","","Africa-at-Large;African Women Seek Role In Peace Building","295 words"," Africa News","","",
"Panafrican News Agency","","","Burundi;Comesa Urged To Help Lift Burundi Sanctions","217 words"," Africa News","","",
"Aly Coulibaly, PANA Correspondent, Panafrican News Agency","","","Senegal;High Hopes For Famished Senegalese Peasants","522 words"," Africa News","","",
"Panafrican News Agency","","","Science and Health;Experts Challenged To Provide Quality Water","261 words"," Africa News","","",
"Panafrican News Agency","","","Science and Health;Call For Creation Of Biodiversity Centre In Tamanrasset","291 words"," Africa News","","",
"Desmond Davies, PANA Correspondent, Panafrican News Agency","","","Liberia;Liberia Welcomes Election To IMO Council","233 words"," Africa News","","",
"Paul Ejime, PANA Staff Correspondent, Panafrican News Agency","","","West Africa;ECOWAS New Chief Outlines Priorities","380 words"," Africa News","","",
"Panafrican News Agency","","","Business and Finance;Stability Returning To Zimbabwe Local Bourse","252 words"," Africa News","","",
"Panafrican News Agency","","","Sports - General;Senegalese Basketball Ace Dies","105 words"," Africa News","","",
"Panafrican News Agency","","","Sports - General;Kenyan Wins Lisbon Marathon","110 words"," Africa News","","",
"Panafrican News Agency","","","Burundi;103 Rebels Killed In Southern Burundi","141 words"," Africa News","","",
"Panafrican News Agency","","","Kenya;Kenya's Electoral Commission Says No To New Poll boxes","218 words"," Africa News","","",
"Panafrican News Agency","","","Zimbabwe;Sithole's Trial For Treason Opens","193 words"," Africa News","","",
"Panafrican News Agency","","","Kenya;Floods Maroon 120,000 In Kenya Refugee Camps","358 words"," Africa News","","",
"Mildred Mulenga, PANA Staff Correspondent, Panafrican News Agency","","","East Africa;COMESA Court Of Justice To Be Based In Lusaka","386 words"," Africa News","","",
"Nelson Magombo, PANA Correspondent, Panafrican News Agency","","","Malawi;Banda May Be Out Of Hospital In Seven Days","189 words"," Africa News","","",
"Desmond Davies, PANA Correspondent, Panafrican News Agency","","","Nigeria;Five-Year-Old Nigerian Boy Excels In Maths","242 words"," Africa News","","",
"Paul Ejime, PANA Staff Correspondent, Panafrican News Agency","","","Liberia;ECOWAS Leaders Consulting On Friction With Liberia","407 words"," Africa News","","",
"Joyce Hamba, Zimbabwe Standard (Harare)","","","Arts and Entertainment;Profile of Zimbabwe Fashion Designer Sonny Mackolisky","781 words"," Africa News","","",
"David Mupfurutsa, Zimbabwe Standard (Harare)","","","Zimbabwe;Call to remove Rhodes' Grave ill-conceived","1006 words"," Africa News","","",
"Thabo Kunene, Zimbabwe Standard (Harare)","","","Zimbabwe;Gwayi-Shangani dam To Displace Ancestors' Graves","429 words"," Africa News","","",
"Staff Writer, Zimbabwe Standard (Harare)","","","Zimbabwe;Institute of Environmental Studies Constructs New office","431 words"," Africa News","","",
"Zimbabwe Standard (Harare)","","","Zimbabwe;Will we ever really know what went wrong on 'Black Friday'?","820 words"," Africa News","","",
"Zimbabwe Standard (Harare)","","","Zimbabwe;Comment: Weep the beloved country (Editorial)","333 words"," Africa News","","",
"Sports Writer, Zimbabwe Standard (Harare)","","","Sports - General;Zimbabwe cricket team in three major international engagements","266 words"," Africa News","","",
"Sports Writer, Zimbabwe Standard (Harare)","","","Sports - General;Malawi's top boxers jet in for a seven-bout extravaganza","438 words"," Africa News","","",
"Sports Writer, Zimbabwe Standard (Harare)","","","Sports - General;Mashonaland Basketball Association stages a 16-team tournament","318 words"," Africa News","","",
"World Food Programme","","","Africa-at-Large; WFP Emergency Report No. 47 - Africa","2325 words"," Africa News","","",
"Timothy Sichela, Times of Zambia (Lusaka)","","","Sports - Soccer;Malawian juniors revenge","282 words"," Africa News","","",
"Joseph Chanda, Times of Zambia (Lusaka)","","","Sports - General;You won't go to 'Club' games, ZOCAGA defaulters told","338 words"," Africa News","","",
"Business Review Reporter, Times of Zambia (Lusaka)","","","Business and Finance;Zambian goods attract global interest","286 words"," Africa News","","",
"Business Review Reporter, Times of Zambia (Lusaka)","","","Business and Finance;Use appropriate technology, advises expert","183 words"," Africa News","","",
"Business Review Reporter, Times of Zambia (Lusaka)","","","Business and Finance;Aim for higher growth rate-ZAM","247 words"," Africa News","","",
"Business Review Reporter, Times of Zambia (Lusaka)","","","Business and Finance;Utilise your potential, Chikwakwa tells small scale traders","352 words"," Africa News","","",
"Business Review Reporter, Times of Zambia (Lusaka)","","","Business and Finance;It's now Land-Rover Freelander","172 words"," Africa News","","",
"Business Review Reporter, Times of Zambia (Lusaka)","","","Business and Finance;Motorists see red over parking fees","279 words"," Africa News","","",
"Business Review Reporter, Times of Zambia (Lusaka)","","","Business and Finance;Create body to check monetary vices, Zambia urged","258 words"," Africa News","","",
"Victor Kayira and Shapi Shacinda, Times of Zambia (Lusaka)","","","Zambia;Ndola bailiffs won't evict Chichele squatters","568 words"," Africa News","","",
"Times Reporter, Times of Zambia (Lusaka)","","","Zambia;Council officials pounce on illegal meat traders","197 words"," Africa News","","",
"Times Reporter, Times of Zambia (Lusaka)","","","Zambia;Comesa court of Justice birth cheers Miyanda","208 words"," Africa News","","",
"Times Reporter, Times of Zambia (Lusaka)","","","Zambia;Zulawu to drag City fathers to court","343 words"," Africa News","","",
"Aston Kuseka, Times of Zambia (Lusaka)","","","Business and Finance;Credit bank chief cries blue murder","414 words"," Africa News","","",
"Times Reporter, Times of Zambia (Lusaka)","","","Zambia;EU hails Zambia","280 words"," Africa News","","",
"Times Reporter, Times of Zambia (Lusaka)","","","Zambia;Devise conduct code, ILGAZ advised","484 words"," Africa News","","",
"Times Reporter, Times of Zambia (Lusaka)","","","Zambia;Pardon Katongo fired","124 words"," Africa News","","",
"Truth and Reconciliation Commission","","","South Africa; Truth Commission Investigators Visit France","293 words"," Africa News","","",
"Masautso Phiri, Post of Zambia (Lusaka)","","","Zambia;Kaunda is on his way home","318 words"," Africa News","","",
"Amos Malupenga, Post of Zambia (Lusaka)","","","Zambia;Coup reporters rewarded","350 words"," Africa News","","",
"Masautso Phiri, Post of Zambia (Lusaka)","","","Zambia;IDEA talks creates suspicion in UNIP","1034 words"," Africa News","","",
"Betty Businge, New Vision (Kampala)","","","Business and Finance;Uganda To Host Accountants Meet","292 words"," Africa News","","",
"John Odyek, New Vision (Kampala)","","","Business and Finance;Alliance Air Sponsors Investor Awards","193 words"," Africa News","","",
"Herbert Ogwang, New Vision (Kampala)","","","Business and Finance;Economics Expert Urges On Policy","211 words"," Africa News","","",
"Patrick Luganda, New Vision (Kampala)","","","Business and Finance;Women's Banks Get 4b/= Facility","280 words"," Africa News","","",
"John Thawite, New Vision (Kampala)","","","Uganda;Kasese To Shoot Poachers Dead","186 words"," Africa News","","",
"John Eremu, New Vision (Kampala)","","","Uganda;World Bank Gives Boost To Universal Primary Education","274 words"," Africa News","","",
"Anne A. Mugisa, New Vision (Kampala)","","","Uganda;Account Or Repay 3b/=, Boss Told","252 words"," Africa News","","",
"Edson Bagada & Cranimer Mugerwa, New Vision (Kampala)","","","Uganda;Kakande Weds In Congo","279 words"," Africa News","","",
"Yunus Abbey, New Vision (Kampala)","","","Business and Finance;Uganda Airlines Officials Sacked","317 words"," Africa News","","",
"Simon Kaheru, New Vision (Kampala)","","","Uganda;Police Smash Cigarette Racket","163 words"," Africa News","","",
"John Kakande, New Vision (Kampala)","","","Uganda;Otafiire Wants Inquiry","203 words"," Africa News","","",
"Alfred Wasike, New Vision (Kampala)","","","Uganda;Danish Prince Queries Lost UWA Funds","428 words"," Africa News","","",
"Vision Reporters, New Vision (Kampala)","","","Uganda;Floods Kill 35","567 words"," Africa News","","",
"John Kakande, New Vision (Kampala)","","","Uganda;Probe Me, Byanyima Fires Back","398 words"," Africa News","","",
"Christof Maletsky, The Namibian (Windhoek)","","","Namibia;DTA cost-saving plan may be destined for dustbin","436 words"," Africa News","","",
"Christof Maletsky, The Namibian (Windhoek)","","","Namibia;The Kabila guessing game ...","491 words"," Africa News","","",
"Christof Maletsky, The Namibian (Windhoek)","","","Namibia;History made as Namibian manufacturers prove worth","353 words"," Africa News","","",
"Tabby Moyo, The Namibian (Windhoek)","","","Namibia;'Stop the buffalo sales!'","386 words"," Africa News","","",
"Chrispin Inambao, The Namibian (Windhoek)","","","Namibia;Namibia wins eco-tourism accolade","446 words"," Africa News","","",
"International Committee of the Red Cross","","","Congo Brazzaville;ICRC Deplores Death Of Red Cross Volunteer In Brazzaville;","303 words"," Africa News","","",
"Western Sahara Referendum Support Association","","","Western Sahara;Sahara Weekly News Update","323 words"," Africa News","","",
"John Yeld, Cape Argus (Cape Town)","","","South Africa;Jobs bonanza as Parks Board gets R30-m funds boost","338 words"," Africa News","","",
"Jermaine Craig, Cape Argus (Cape Town)","","","South Africa;Freedom for Madiba in city that was his prison","338 words"," Africa News","","",
"POLITICAL STAFF, Cape Argus (Cape Town)","","","South Africa;Leon set to fight foreign election aid","130 words"," Africa News","","",
"Political Staff, Cape Argus (Cape Town)","","","South Africa;Kriel and Omar deny talks on top posts","53 words"," Africa News","","",
"Ashley Smith and Johan Schronen, Cape Argus (Cape Town)","","","South Africa;Man killed in Flats fast-food shootout","325 words"," Africa News","","",
"Cape Argus (Cape Town)","","","South Africa;Tough stance on crime an erosion of rights? (Editorial)","315 words"," Africa News","","",
"John Yeld and Robert Brand, Cape Argus (Cape Town)","","","South Africa;It's Winnie's moment of truth","821 words"," Africa News","","",
"Llewellyn Jones, Cape Argus (Cape Town)","","","Business and Finance;Investors from Cape Flats give Brimstone plenty of fire","448 words"," Africa News","","",
"Dennis Cavernelis, Cape Argus (Cape Town)","","","South Africa;Do the crime, do the time: bill lays down law","377 words"," Africa News","","",
"Dennis Cavernelis, Cape Argus (Cape Town)","","","South Africa;Killers, rapists, hijackers now face 25-year terms","515 words"," Africa News","","",
"Sharon Hammond, African Eye News Service (South Africa)","","","South Africa;Mpumalanga must learn from its mistakes - Phosa","554 words"," Africa News","","",
"Dumisane Lubisi, African Eye News Service (South Africa)","","","South Africa;70 Hippo Water Rollers for rural community of Mpumalanga","336 words"," Africa News","","",
"John Hammond, African Eye News Service (South Africa)","","","South Africa;No consultation about Witbank/Middelburg toll road","146 words"," Africa News","","",
"Sharon Hammond, African Eye News Service (South Africa)","","","South Africa;Daimler-Benz will refuse offer to develop Primkop airport site","519 words"," Africa News","","",
"Stephen Mburu, The Nation (Nairobi)","","","Kenya;Ndingi hits at 'defeatist' MPs","866 words"," Africa News","","",
"The Nation (Nairobi)","","","Business and Finance;Fair trade practices should be key factor (Editorial)","386 words"," Africa News","","",
"Mohamed Adow, The Nation (Nairobi)","","","Kenya;Policeman kills 2 colleagues, self","274 words"," Africa News","","",
"Nation Team, The Nation (Nairobi)","","","Kenya;Wrangles cloud Kanu poll day","627 words"," Africa News","","",
"All Africa Press Service","","","Senegal;Missionaries Leave Troubled Senegalese Region","962 words"," Africa News","","",
"Sam Gonza, All Africa Press Service","","","East Africa;Tanzania Cautioned Against Invading Burundi","1106 words"," Africa News","","",
"All Africa Press Service","","","South Africa;"Forgive Us," South African Churches Beg Commission","1390 words"," Africa News","","",
"All Africa Press Service","","","Sudan;Ecumenical Peace Centres Proposed For Churches In Sudan","946 words"," Africa News","","",
"All Africa Press Service","","","Kenya;Kenyan Churches In Post-Election Prayers","464 words"," Africa News","","",
"All Africa Press Service","","","East Africa;East African Food Reserves Depleted As Floods Persist","555 words"," Africa News","","",
"All Africa Press Service","","","Uganda;Post-Elections Wife-Beating Sparks Uproar In Uganda","542 words"," Africa News","","",
"All Africa Press Service","","","Morocco;Morocco's Left Garners Major Gains In First Direct Polls","612 words"," Africa News","","",
"All Africa Press Service","","","Niger;Niger's Students Demonstrate Against Rebel Activity","763 words"," Africa News","","",
"All Africa Press Service","","","Rwanda;Fighting Between Rwandan Troops, Rebels Spreads Fear","641 words"," Africa News","","",
"All Africa Press Service","","","Nigeria;Scepticism As Nigeria's Abacha Promises To Free Dissidents","712 words"," Africa News","","",
"All Africa Press Service","","","Science and Health;Uganda: Muslim, Catholic Leaders Differ On Condom Use","911 words"," Africa News","","",
"Nation Correspondent, The Nation (Nairobi)","","","Kenya;Police recover 10 guns","243 words"," Africa News","","",
"Michael Njuguna And Nation Correspondent, The Nation (Nairobi)","","","Kenya;President issues order on clashes","320 words"," Africa News","","",
"Nation Correspondents, The Nation (Nairobi)","","","Kenya;Gang hurls bomb at candidate's car","283 words"," Africa News","","",
"Michael Njuguna, The Nation (Nairobi)","","","Kenya;Njenga Mungai goes to Kanu","618 words"," Africa News","","",
"Nick Oyo, The Nation (Nairobi)","","","Sports - Soccer;KFF rule book to be updated, says Nurrein","460 words"," Africa News","","",
"The Nation (Nairobi)","","","Kenya;Act now to ensure peaceful elections (Editorial)","376 words"," Africa News","","",
"Eric Shimoli, The Nation (Nairobi)","","","Kenya;Chesoni orders violence probe","587 words"," Africa News","","",
"Star Radio (Monrovia)","","","Liberia; Liberian Daily News Bulletin","1288 words"," Africa News","","",
"Betty Kagoro, New Vision (Kampala)","","","Uganda;Kaijuka Blasts MPs Over 'Time-Wasting'","204 words"," Africa News","","",
