"BYLINE","DATE","DATELINE","HEADLINE","LENGTH","PUBLICATION","SECTION","TITLE",
"African Faith and Justice Network (Washington, DC)","","","Liberia; March Briefing Paper on Liberia","1734 words"," Africa News","","",
"Western Sahara Referendum Support Association","","","Western Sahara;Sahara Weekly News Update (03/03 - 03/10)","787 words"," Africa News","","",
"Truth and Reconciliation Commission","","","South Africa; Amnesty Committee to Hear Eastern Cape Cases","534 words"," Africa News","","",
"Chemist Mafuba, PANA Correspondent, Panafrican News Agency","","","Zimbabwe;Urban Folks Till The Land To Survive","1448 words"," Africa News","","",
"Paul Ejime, PANA Staff Correspondent, Panafrican News Agency","","","Nigeria;Nigerian Driver Returns Lost Money Worth 60,000 U.S. Dollars","840 words"," Africa News","","",
"Ghion Hagos, PANA Staff Correspondent, Panafrican News Agency","","","Ethiopia;Attempted Jail Break Foiled In Addis Ababa","280 words"," Africa News","","",
"Panafrican News Agency","","","Zambia;Zambian Students Protest Non-Payment Of Allowances","440 words"," Africa News","","",
"Yahya El Hassan, PANA Correspondent, Panafrican News Agency","","","East Africa;Sudan Threatens To Attack Uganda","534 words"," Africa News","","",
"Goddy Ikeh, PANA Correspondent, Panafrican News Agency","","","Business and Finance;Campaign To Save The Nigerian Leather Industry","1134 words"," Africa News","","",
"Panafrican News Agency","","","Cote d'Ivoire;Ivorian Leader Pardons Teenage Killer","120 words"," Africa News","","",
"Panafrican News Agency","","","Business and Finance;Nigeria Airways Gets New Managing Director","267 words"," Africa News","","",
"Ali Delali, PANA Staff Correspondent, Panafrican News Agency","","","Business and Finance;Libya Earned Nine Billion Dollars in 1996","387 words"," Africa News","","",
"Panafrican News Agency","","","Zimbabwe;Panic As Mugabe's Plane Develops Engine Trouble","560 words"," Africa News","","",
"Panafrican News Agency","","","Zimbabwe;Mugabe's Vision of New Africa","947 words"," Africa News","","",
"Malawi News Online","","","Malawi;Malawi News Roundup","1414 words"," Africa News","","",
"Malawi News Online","","","Malawi;Devastation in the Shire Valley","960 words"," Africa News","","",
"Justin Arenstein, African Eye News Service (South Africa)","","","South Africa;NGOs continue to oppose R12,2-billion Dolphin deal","800 words"," Africa News","","",
"George Mthethwa, African Eye News Service (South Africa)","","","South Africa;Student organisations clash over boycott","374 words"," Africa News","","",
"Mzilikazi wa Afrika, African Eye News Service (South Africa)","","","South Africa;Sole survivor of flash flood speaks from hospital bed","480 words"," Africa News","","",
"Sylvestor Lukhele & Justin Arenstein, African Eye News Service (South Africa)","","","South Africa;50 farm labourers forced to sleep in ditch after eviction","614 words"," Africa News","","",
"Mzilikazi wa Afrika, African Eye News Service (South Africa)","","","South Africa;Mozambican dies after Mpumalanga hospitals refuse to admit her","574 words"," Africa News","","",
"Mzilikazi wa Afrika, African Eye News Service (South Africa)","","","South Africa;14 taxi drivers accused of execution killings","507 words"," Africa News","","",
"Mzilikazi wa Afrika, African Eye News Service (South Africa)","","","South Africa;Elderly labourer suffocates in grain bin","227 words"," Africa News","","",
"Committee to Protect Journalists (CPJ)","","","Togo; CPJ Protests Ban on Togolese Independent Weekly","374 words"," Africa News","","",
"UN Department of Humanitarian Affairs","","","East Africa; Emergency Update No. 124 on the Great Lakes (03/11)","2107 words"," Africa News","","",
"Congress of South African Trade Unions (COSATU)","","","South Africa; Labour's Approach To The 1997/8 Budget","2347 words"," Africa News","","",
"Michael Morris, Cape Argus (Cape Town)","","","South Africa;Bid battle triggers crime blitz","520 words"," Africa News","","",
"John Freudenberg, Cape Argus (Cape Town)","","","Sports - General;Desmond Haynes: 26 000 runs on the opener closes his innings","1027 words"," Africa News","","",
"Llewelly Jones, Cape Argus (Cape Town)","","","Business and Finance;Duty evasion, smuggling costs South Africa","534 words"," Africa News","","",
"Dennis Cavernelis, Cape Argus (Cape Town)","","","South Africa;Long jail terms for killers","347 words"," Africa News","","",
"Cape Argus (Cape Town)","","","South Africa;Manuel's first Budget (Editorial)","360 words"," Africa News","","",
"Johan Schronen and Joseph Aranes, Cape Argus (Cape Town)","","","South Africa;Cops hold city gang","800 words"," Africa News","","",
"Takesure Matarise, PANA Correspondent, Panafrican News Agency","","","Science and Health;Scientists Seek Wines In The Zimbabwean Wild","1120 words"," Africa News","","",
"Paul Ejime, PANA Staff Correspondent, Panafrican News Agency","","","Sierra Leone;Nigerian Army Confirms Sankoh's Presence In The Country","307 words"," Africa News","","",
"Paul Ejime, PANA Staff Correspondent, Panafrican News Agency","","","Nigeria;Nobel Laureate, 15 Others Charged With Treason","547 words"," Africa News","","",
"Olu Sarr, PANA Staff Correspondent, Panafrican News Agency","","","United States and Africa;Hillary Clinton Begins Africa Tour Saturday","587 words"," Africa News","","",
"Alemshet Kebede, Ethiopian News Agency","","","Arts and Entertainment;Ethiopian symposium examines draft culture policy","480 words"," Africa News","","",
"Ethiopian News Agency","","","Ethiopia;Witnesses testify against Derg Officials","614 words"," Africa News","","",
"Ethiopian News Agency","","","Ethiopia;House registers significant achievements, speaker says","334 words"," Africa News","","",
"Ethiopian News Agency","","","Ethiopia;Shinile Zone appeals for relief aid","574 words"," Africa News","","",
"United Nations","","","East Africa; Statement by the President of the UNSC","854 words"," Africa News","","",
"African National Congress of South Africa","","","South Africa; IFP March In Johannesburg 12 March","600 words"," Africa News","","",
"Africa Policy Information Center (Washington, DC)","","","United States and Africa; Law Group Wants U.S. to Bar Algerians","947 words"," Africa News","","",
"UN Department of Humanitarian Affairs","","","East Africa; Emergency Update No. 125 on the Great Lakes (03/12)","1480 words"," Africa News","","",
"Llewellyn Jones, Cape Argus (Cape Town)","","","Business and Finance;Life Offices Association won't collapse - Director","574 words"," Africa News","","",
"Sharkey Isaacs, Cape Argus (Cape Town)","","","Arts and Entertainment;Frank Brown: Love of art helped conquer lost years of apartheid","947 words"," Africa News","","",
"Joseph Aranes, Cape Argus (Cape Town)","","","South Africa;W Cape policemen linked to gangs and drug rings","520 words"," Africa News","","",
"John Yeld, Cape Argus (Cape Town)","","","South Africa;We 'necklaced' ANC activist, police admit","507 words"," Africa News","","",
"Jermaine Craig, Staff Reporter, Cape Argus (Cape Town)","","","Business and Finance;New Table Bay Hotel 'in a class of its own'","627 words"," Africa News","","",
"Clive Sawyer, Alide Dasnois and William-Mervin Gumede, Cape Argus (Cape Town)","","","South Africa;A budget for the Poor","840 words"," Africa News","","",
"David Musoke, PANA Correspondent, Panafrican News Agency","","","Uganda;Uganda Moves To Stamp Out Corruption","1438 words"," Africa News","","",
"Abdoulaye Traore, PANA Correspondent, Panafrican News Agency","","","Mali;Canadian Company Wins Mali Gold Exploration Concession","174 words"," Africa News","","",
"Mildred Mulenga, PANA Staff Correspondent, Panafrican News Agency","","","Zambia;Zambia To Get About 217 Million Dollars From EU","427 words"," Africa News","","",
"Congress of South African Trade Unions (COSATU)","","","Business and Finance; SA Labour Federation Finds Good and Bad in Budget","2120 words"," Africa News","","",
"UN Department of Humanitarian Affairs","","","East Africa; Emergency Update No. 126 on the Great Lakes (03/13)","1640 words"," Africa News","","",
"Thabo Mabaso, Business Reporter, Cape Argus (Cape Town)","","","Business and Finance;South Africa: Cosatu slams Budget's job creation 'failure'","547 words"," Africa News","","",
"Andrea Weiss, Cape Argus (Cape Town)","","","South Africa;World-class convention centre is on","200 words"," Africa News","","",
"Michael Morris, Cape Argus (Cape Town)","","","Sports - General;Olympics: Cape Town front page news around world","440 words"," Africa News","","",
"Jenny Viall, Cape Argus (Cape Town)","","","South Africa;Melanie Reinhart: leading a new acceptance of celestial healing","947 words"," Africa News","","",
"Cape Argus (Cape Town)","","","South Africa;Manuel's achievement (Editorial)","400 words"," Africa News","","",
"Jenny Viall, Cape Argus (Cape Town)","","","South Africa;Budget: 'Lives at risk' in Tygerberg's cardiology unit","467 words"," Africa News","","",
"Hugh Roberton and Jermaine Craig, Cape Argus (Cape Town)","","","South Africa;'Marriage' rights for gay couples","707 words"," Africa News","","",
"UN Department of Humanitarian Affairs","","","East Africa; Emergency Update No. 127 on the Great Lakes (03/14)","1614 words"," Africa News","","",
"Truth and Reconciliation Commission","","","South Africa; Truth Panel Seeks to Clarify Stance on Informers","627 words"," Africa News","","",
"Olu Sarr, PANA Staff Correspondent, Panafrican News Agency","","","Africa-at-Large;Weekly Press Review","1067 words"," Africa News","","",
"Tom Holloway, PANA Correspondent, Panafrican News Agency","","","Swaziland;Swaziland Frowns At Homosexuals","414 words"," Africa News","","",
"Panafrican News Agency","","","Business and Finance;Air Zimbabwe Pilots, Engineers Strike, Passengers Stranded","707 words"," Africa News","","",
"Paul Ejime, PANA Staff Correspondent, Panafrican News Agency","","","Nigeria;Offical Says 55.7 Million Voters Registered In Nigeria","560 words"," Africa News","","",
"Paul Ejime, PANA Staff Correspondent, Panafrican News Agency","","","Nigeria;Nigeria Says No Foreigner Involved In Seized Oil Barge","294 words"," Africa News","","",
"Paul Ejime, PANA Staff Correspondent, Panafrican News Agency","","","Nigeria;Canada Closes Its Diplomatic Mission In Nigeria","414 words"," Africa News","","",
"Zambia News Online","","","Zambia;Jailed Editor Back In Lusaka Prison","347 words"," Africa News","","",
"Zambia News Online","","","Zambia;Zambia News Online","854 words"," Africa News","","",
"Zambia News Online","","","Zambia;Get Rich Quick Schemes Entice Zambians","280 words"," Africa News","","",
"Zambia News Online","","","Business and Finance;Zambians Worry Over Sale Of ZCCM","160 words"," Africa News","","",
"Zambia News Online","","","Zambia;Zambian Women Wrangle Over Women's Day","1387 words"," Africa News","","",
"Ethiopian News Agency","","","Ethiopia;Trial of alleged red terror perpetrators to commence soon","106 words"," Africa News","","",
"Ethiopian News Agency","","","Science and Health;Red fox found in North Wollo highlands","147 words"," Africa News","","",
"Ethiopian News Agency","","","United States and Africa;Witness says US diplomat tortured in Derg " Bermuda"","494 words"," Africa News","","",
"Abebe Gelaw, Ethiopian News Agency","","","Ethiopia;The aid distribution began in December last year","427 words"," Africa News","","",
"Ethiopian News Agency","","","Ethiopia;DPPC calls on donors to assist drought victims","387 words"," Africa News","","",
"World Health Organization (Geneva)","","","Science and Health; Meningitis, Meningococcal - Togo, Burkina Faso & Ghana","400 words"," Africa News","","",
"U.S. Agency for International Development (USAID)","","","United States and Africa; U.S. Great Lakes Situation Report No. 26","4454 words"," Africa News","","",
"Truth and Reconciliation Commission","","","South Africa; Former Policemen Lead TRC To Secretly Buried Bodies","280 words"," Africa News","","",
"Alide Dasnois, Business Editor, Cape Argus (Cape Town)","","","Business and Finance;Mboweni tells SA unions to act on discrimination","627 words"," Africa News","","",
"Gorry Bowes-Taylor, Cape Argus (Cape Town)","","","Science and Health;Chris Damerell: a universe to study...but first an old boys' dinner","1267 words"," Africa News","","",
"Jermaine Craig, Cape Argus (Cape Town)","","","Business and Finance;Planning on track for Cape Flats business link","534 words"," Africa News","","",
"Cape Argus (Cape Town)","","","South Africa;Gay and lesbian equality (Editorial)","400 words"," Africa News","","",
"William-Mervyn Gumede, Cape Argus (Cape Town)","","","South Africa;SANDF all set to march into 21st century","1427 words"," Africa News","","",
"Charlene Clayton and Michael Morris, Cape Argus (Cape Town)","","","South Africa;House prices going for gold","747 words"," Africa News","","",
"Arthur Goldstuck, Mail and Guardian (Johannesburg)","","","Business and Finance;WEB FEET: Notes from the Net (Column)","400 words"," Africa News","","",
"Mail and Guardian (Johannesburg)","","","Business and Finance;South Africa: Looking for a local niche","1040 words"," Africa News","","",
"Hazel Friedman, Mail and Guardian (Johannesburg)","","","Business and Finance;South Africa: Educational TV gets creative","574 words"," Africa News","","",
"Lyndall Campher, Mail and Guardian (Johannesburg)","","","Business and Finance;South Africa: SPOTLIGHT ON MEDIA (Column)","574 words"," Africa News","","",
"Mail and Guardian (Johannesburg)","","","Business and Finance;South Africa: Finance Week hits back","960 words"," Africa News","","",
"Jacquie Golding-Duffy, Mail and Guardian (Johannesburg)","","","Business and Finance;South Africa: Softly, softly catches readers","787 words"," Africa News","","",
"Lynda Loxton, Mail and Guardian (Johannesburg)","","","Business and Finance;South Africa:' Small businesses will have to wait","760 words"," Africa News","","",
"Gustav Thiel, Mail and Guardian (Johannesburg)","","","Business and Finance;South Africa: Smokers hit with 'unfair' excise hike","560 words"," Africa News","","",
"Mail and Guardian (Johannesburg)","","","Business and Finance;South Africa: Manuel banks on more efficient tax collection","667 words"," Africa News","","",
"Mail and Guardian (Johannesburg)","","","Business and Finance;South Africa: Comments from the gallery","774 words"," Africa News","","",
"Madeleine Wackernagel, Mail and Guardian (Johannesburg)","","","Business and Finance;South Africa: Manuel walks the tightrope with ease","627 words"," Africa News","","",
"Mail and Guardian (Johannesburg)","","","Business and Finance;South Africa: Manuel heralds the year of the turnaround","747 words"," Africa News","","",
"Lynda Loxton, Mail and Guardian (Johannesburg)","","","Business and Finance;South Africa: Biting on the exchange control bullet","827 words"," Africa News","","",
"Mail and Guardian (Johannesburg)","","","Business and Finance;South Africa: Budget boost for Gear","814 words"," Africa News","","",
"Mail and Guardian (Johannesburg)","","","South Africa;Bomb fuel helps cure cancer","1254 words"," Africa News","","",
"Mail and Guardian (Johannesburg)","","","Arts and Entertainment;Bitter fruits for artists","1640 words"," Africa News","","",
"Mail and Guardian (Johannesburg)","","","South Africa;OFFICE OF THE PRESIDENT (Column)","654 words"," Africa News","","",
"Mail and Guardian (Johannesburg)","","","South Africa;Security is still 'devilish' (Commentary)","1120 words"," Africa News","","",
"Krisjan Lemmer, Mail and Guardian (Johannesburg)","","","South Africa;LIFE ON THE SOUTHERN TIP (Column)","654 words"," Africa News","","",
"Mail and Guardian (Johannesburg)","","","South Africa;Slow and steady wins on the airwaves","520 words"," Africa News","","",
"Mail and Guardian (Johannesburg)","","","South Africa;Way to go, Trevor! (Editorial)","494 words"," Africa News","","",
"Mail and Guardian (Johannesburg)","","","Zaire;French calls for Zaire force spurned","1694 words"," Africa News","","",
"Mail and Guardian (Johannesburg)","","","Botswana;Bushmen cash offer claims are 'lies' K Letsholo","587 words"," Africa News","","",
"Rip Hopkins, Mail and Guardian (Johannesburg)","","","South Africa;City of the child-catchers","440 words"," Africa News","","",
"Mail and Guardian (Johannesburg)","","","Zambia;Chiluba, Kaunda in 'secret deal'","680 words"," Africa News","","",
"Mail and Guardian (Johannesburg)","","","South Africa;The ANGELLA JOHNSON Interview: Modern-day Courtesan","1760 words"," Africa News","","",
"Marion Edmunds, Mail and Guardian (Johannesburg)","","","South Africa;Government accused of manipulation","480 words"," Africa News","","",
"Mail and Guardian (Johannesburg)","","","South Africa;Bushmen left to rot in the Karoo","1414 words"," Africa News","","",
"Mail and Guardian (Johannesburg)","","","South Africa;Asylum rush swamps government","1267 words"," Africa News","","",
"Gustav Thiel, Mail and Guardian (Johannesburg)","","","Sports - General;Sonn storm creates a cricket divide","520 words"," Africa News","","",
"Marion Edmunds, Mail and Guardian (Johannesburg)","","","South Africa;Maties rector 'also got payout'","667 words"," Africa News","","",
"Mail and Guardian (Johannesburg)","","","South Africa;Bengu's efforts too little too late","867 words"," Africa News","","",
"Stuart Hess, Mail and Guardian (Johannesburg)","","","Business and Finance;South African Unions' R1bn health saving","707 words"," Africa News","","",
"Mail and Guardian (Johannesburg)","","","South Africa;Fresh fears for Zulu peace","1107 words"," Africa News","","",
"Mail and Guardian (Johannesburg)","","","South Africa;Phosa's brother in RDP probe","547 words"," Africa News","","",
"Mungo Soggot, Mail and Guardian (Johannesburg)","","","Business and Finance;Cover-up of Telkom contract fee","454 words"," Africa News","","",
"Gustav Thiel, Mail and Guardian (Johannesburg)","","","South Africa;No ball in Paarl sports hall","614 words"," Africa News","","",
"Stuart Hess, Mail and Guardian (Johannesburg)","","","Sports - General;Rugby's inside story","360 words"," Africa News","","",
"Stefaans BrUmmer, Mail and Guardian (Johannesburg)","","","Business and Finance;Sol's arrest stopped at 11th hour","547 words"," Africa News","","",
"Mail and Guardian (Johannesburg)","","","South Africa;Two faces of the north's Greek 'saint'","1080 words"," Africa News","","",
"Ann Eveleth, Mail and Guardian (Johannesburg)","","","South Africa;Black security firm has old IFP links","960 words"," Africa News","","",
"Mail and Guardian (Johannesburg)","","","South Africa;Holomisa flirts with Mangope","760 words"," Africa News","","",
"Jim Day, Mail and Guardian (Johannesburg)","","","South Africa;Dances with Zulus","1080 words"," Africa News","","",
"Mail and Guardian (Johannesburg)","","","South Africa;Military agent was killed by police","880 words"," Africa News","","",
"Mail and Guardian (Johannesburg)","","","South Africa;NEWS IN BRIEF","734 words"," Africa News","","",
"Stefaans BrUmmer, Mail and Guardian (Johannesburg)","","","South Africa;Top cop's death investigated for foul play","760 words"," Africa News","","",
"Mail and Guardian (Johannesburg)","","","South Africa;Tracking down spies in ANC","654 words"," Africa News","","",
"Mail and Guardian (Johannesburg)","","","South Africa;PEOPLE (Column)","320 words"," Africa News","","",
"Angella Johnson, Mail and Guardian (Johannesburg)","","","South Africa;King Leka on way to Albania","400 words"," Africa News","","",
"Mail and Guardian (Johannesburg)","","","South Africa;Parks board chief's empire","1067 words"," Africa News","","",
"Jon Swift, Mail and Guardian (Johannesburg)","","","Sports - General;RUGBY: Wanted -- A full 80 minutes of effort","840 words"," Africa News","","",
"Chris Taylor, Mail and Guardian (Johannesburg)","","","Sports - Soccer;Zico's boys from Brazil","1387 words"," Africa News","","",
"Andrew Muchineripi, Mail and Guardian (Johannesburg)","","","Sports - General;SOCCER: The hardest coaching job in Africa","894 words"," Africa News","","",
"Mail and Guardian (Johannesburg)","","","Sports - General;Women vaulters finally crack glass ceiling","1067 words"," Africa News","","",
"Jon Swift, Mail and Guardian (Johannesburg)","","","Sports - General;CRICKET: The right blend to beat the crisis","1534 words"," Africa News","","",
"Julian Drew, Mail and Guardian (Johannesburg)","","","Sports - General;Now the race for votes","1454 words"," Africa News","","",
"Mail and Guardian (Johannesburg)","","","Arts and Entertainment;Farewell to CNA award","1387 words"," Africa News","","",
"Thomas Mallon, Mail and Guardian (Johannesburg)","","","Arts and Entertainment;Power to transfigure","680 words"," Africa News","","",
"Mail and Guardian (Johannesburg)","","","Arts and Entertainment;CULTURAL SUSHI","760 words"," Africa News","","",
"Mail and Guardian (Johannesburg)","","","Arts and Entertainment;Portrait of a woman","1734 words"," Africa News","","",
"Maria McCloy, Mail and Guardian (Johannesburg)","","","Arts and Entertainment;DESIGN OF THE WEEK","307 words"," Africa News","","",
"Shaun de Waal, Mail and Guardian (Johannesburg)","","","Arts and Entertainment;POP ON CD: Back to earth","480 words"," Africa News","","",
"Mail and Guardian (Johannesburg)","","","Arts and Entertainment;Almost an explosion","1147 words"," Africa News","","",
"Mail and Guardian (Johannesburg)","","","Arts and Entertainment;Trust no one, deny everything","1734 words"," Africa News","","",
"Gavin Dudley, Mail and Guardian (Johannesburg)","","","Business and Finance;Countdown to zero","547 words"," Africa News","","",
"Dror Eyal, Mail and Guardian (Johannesburg)","","","Arts and Entertainment;May the grey be with you","1694 words"," Africa News","","",
"Swapna Prabhakaran, Mail and Guardian (Johannesburg)","","","Arts and Entertainment;Dances with attitudes","1000 words"," Africa News","","",
"Mail and Guardian (Johannesburg)","","","Arts and Entertainment;Music for the multi-culture","814 words"," Africa News","","",
"Mail and Guardian (Johannesburg)","","","Arts and Entertainment;Theatre out of nothing","1320 words"," Africa News","","",
"Dennis Mair, Mail and Guardian (Johannesburg)","","","Arts and Entertainment;South Africa: Capab in crisis","560 words"," Africa News","","",
"Our Staff Reporter, Addis Tribune (Addis Ababa)","","","Sports - General;Ethiopia's winners of China relay receive Poor Welcome","133 words"," Africa News","","",
"Dr. Richard Pankhurst, Addis Tribune (Addis Ababa)","","","Ethiopia;A History of Early Twentieth Century Ethiopia (10)","1574 words"," Africa News","","",
"Lissa Pelham, Addis Tribune (Addis Ababa)","","","Business and Finance;Development Guaranteed But When is Enough, Enough?","947 words"," Africa News","","",
"Our Economics Correspondent, Addis Tribune (Addis Ababa)","","","Business and Finance;A Digest of the Major Economic Statements by PM Meles","2507 words"," Africa News","","",
"Our Staff Reporter, Addis Tribune (Addis Ababa)","","","Arts and Entertainment;Theodros Teshome - Ethiopia's New Film-Maker","1080 words"," Africa News","","",
"Our Staff Reporter, Addis Tribune (Addis Ababa)","","","Ethiopia;Swiss Mission Looks into Ways of Assisting Decentralisation","374 words"," Africa News","","",
"Our Staff Reporter, Addis Tribune (Addis Ababa)","","","Ethiopia;Ethio-Indian Tie Strengthened After PM's Visit","214 words"," Africa News","","",
"Our Staff Reporter, Addis Tribune (Addis Ababa)","","","Ethiopia;Black Lion's Director Hopes to Make Further Contribution","254 words"," Africa News","","",
"Our Staff Reporter, Addis Tribune (Addis Ababa)","","","Ethiopia;Letter: Tourism and Ethiopia","1587 words"," Africa News","","",
"Tamrat Bekele, Addis Tribune (Addis Ababa)","","","Ethiopia;Attacks on the Press (Editorial)","227 words"," Africa News","","",
"Our Staff Reporter, Addis Tribune (Addis Ababa)","","","Ethiopia;Gojam Farmers Appeal to Federal Government","294 words"," Africa News","","",
"Our Staff Reporter, Addis Tribune (Addis Ababa)","","","Sports - General;Ethiopia's Haile Set to Dash for a Million","227 words"," Africa News","","",
"Our Economics Correspondent, Addis Tribune (Addis Ababa)","","","Ethiopia;Unorthodox Economics (Rent Hikes by Ethiopian Orthodox Church)","1734 words"," Africa News","","",
"Mzilikazi wa Afrika & Justin Arenstein, African Eye News Service (South Africa)","","","South Africa;Massive funeral for assassinated taxi drivers","507 words"," Africa News","","",
"Mzilikazi wa Afrika & Justin Arenstein, African Eye News Service (South Africa)","","","South Africa;Disgraced MP begins prison sentence","600 words"," Africa News","","",
"Justin Arenstein, African Eye News Service (South Africa)","","","South Africa;International incident brewing over Dolpin Deal","2160 words"," Africa News","","",
"Mzilikazi wa Afrika, African Eye News Service (South Africa)","","","South Africa;Mozambique considers formal inquest after hospital fiasco","707 words"," Africa News","","",
"Wilf Nussey, African Eye News Service (South Africa)","","","South Africa;Boards restructured in provincial cost cutting","534 words"," Africa News","","",
"Wilf Nussey, African Eye News Service (South Africa)","","","Business and Finance;Nelspruit could be first town in SA to get casino complex","1080 words"," Africa News","","",
"UN Department of Humanitarian Affairs","","","East Africa; Emergency Update No. 128 on the Great Lakes (03/15-16)","1254 words"," Africa News","","",
"UN Department of Humanitarian Affairs","","","East Africa; Emergency Update No. 130 on the Great Lakes (03/18)","3094 words"," Africa News","","",
