"BYLINE","DATE","DATELINE","HEADLINE","LENGTH","PUBLICATION","SECTION","TITLE",
"Lionel Williams, PANA Correspondent, Panafrican News Agency","","","South Africa;Four Dead, 200 Hurt in South African Riots","334 words"," Africa News","","",
"Panafrican News Agency","","","Tanzania;Coca-Cola Commissions Dar Es Salaam Plant","240 words"," Africa News","","",
"U.S. Department of State","","","United States and Africa; Shattuck Praises Efforts of Human Rights Workers in Rwanda","360 words"," Africa News","","",
"Action by Churches Together(ACT)","","","Kenya; Severe Drought Sweeps Across Kenya and Grips Tanzania","720 words"," Africa News","","",
"Ethiopian News Agency","","","Ethiopia;Meles Confers with Cardinal of Vatican","294 words"," Africa News","","",
"Ethiopian News Agency","","","Ethiopia;President receives Eritrean ambassador","227 words"," Africa News","","",
"Ethiopian News Agency","","","Ethiopia;Students' conference under way in Makalle","560 words"," Africa News","","",
"Ethiopian News Agency","","","Ethiopia;Id-Alfeter celebrated nation-wide","294 words"," Africa News","","",
"Ethiopian News Agency","","","Ethiopia;Office Collects Population Data","200 words"," Africa News","","",
"Ethiopian News Agency","","","Ethiopia;Public Discusses Draft Amendments In Civil Code","374 words"," Africa News","","",
"World Food Programme","","","Zaire; WFP Eastern Zaire Situation Report No. 44","467 words"," Africa News","","",
"World Food Programme","","","Africa-at-Large; WFP Emergency Report No. 6 - Africa (02/07)","2614 words"," Africa News","","",
"Panafrican News Agency","","","Business and Finance;African Currencies: CFA Franc Under Pressure","1259 words"," Africa News","","",
"Panafrican News Agency","","","Business and Finance;AGC Production Hits 1.1 Million Ounces","440 words"," Africa News","","",
"Panafrican News Agency","","","Ghana;Need To Review World Bank Programmes","467 words"," Africa News","","",
"Segun Adeyemi, PANA Correspondent, Panafrican News Agency","","","Angola;UN Gives Conditions For Extension of Angolan Mission","480 words"," Africa News","","",
"Mildred Mulenga, PANA Staff Correspondent, Panafrican News Agency","","","Zambia;Zambia's Supreme Court Sentences Journalist","387 words"," Africa News","","",
"Panafrican News Agency","","","Angola;Malay & Filipino Captured By Rebels In Cabinda","294 words"," Africa News","","",
"Paul Ejime, PANA Staff Correspondent, Panafrican News Agency","","","Nigeria;Voter Registration Enters Day Two In Nigeria","467 words"," Africa News","","",
"UN Department of Humanitarian Affairs","","","East Africa; Emergency Update No. 99 on the Great Lakes (02/12)","1960 words"," Africa News","","",
"Africa Policy Information Center (Washington, DC)","","","United States and Africa; Alert: US Human Rights Report","1800 words"," Africa News","","",
"Truth and Reconciliation Commission","","","South Africa;","307 words"," Africa News","","",
"World Health Organization (Geneva)","","","Science and Health; Meningitis Outbreak in Togo","200 words"," Africa News","","",
"UN Department of Humanitarian Affairs","","","East Africa; Emergency Update No. 98 on the Great Lakes (02/11)","1334 words"," Africa News","","",
"Panafrican News Agency","","","Eritrea;Eritrean Youths Combat Health Problems Through Education","587 words"," Africa News","","",
"Panafrican News Agency","","","Mozambique;Mozambique Harvests More Crops","334 words"," Africa News","","",
"Segun Adeyemi, PANA Correspondent, Panafrican News Agency","","","Rwanda;Mismanagement Discovered At Rwanda U.N. Tribunal","814 words"," Africa News","","",
"Ghion Hagos, PANA Staff Correspondent, Panafrican News Agency","","","Ethiopia;Two People Killed In Ethiopian Bomb Blast","374 words"," Africa News","","",
"Panafrican News Agency","","","Nigeria;Another Bomb Explosion Rocks Lagos","374 words"," Africa News","","",
"Segun Adeyemi, PANA Correspondent, Panafrican News Agency","","","Africa-at-Large;Rwanda Tribunal Officials To New York","414 words"," Africa News","","",
"Panafrican News Agency","","","Ghana;World Bank Boss Leaves Ghana For South Africa","507 words"," Africa News","","",
"Yahya El Hassan, PANA Correspondent, Panafrican News Agency","","","Sudan;Sudan Unhappy About OAU Position Towards War","480 words"," Africa News","","",
"Paul Ejime, PANA Staff Correspondent, Panafrican News Agency","","","Nigeria;Three African Presidents Confer On Security","294 words"," Africa News","","",
"Paul Ejime, PANA Staff Correspondent, Panafrican News Agency","","","Nigeria;Lagos Calm After Wednesday's Bomb Blast","374 words"," Africa News","","",
"Arthur Goldstuck, Mail and Guardian (Johannesburg)","","","Business and Finance;WEB FEET - Notes From The Net","600 words"," Africa News","","",
"Suzy Bell, Mail and Guardian (Johannesburg)","","","Business and Finance;'Hungry Young Journos' At The Cutting Edge","560 words"," Africa News","","",
"Mail and Guardian (Johannesburg)","","","United States and Africa;Call From Death Row","1267 words"," Africa News","","",
"Mail and Guardian (Johannesburg)","","","Business and Finance;Matter of Fact (Corrections)","120 words"," Africa News","","",
"Lyndall Campher, Column, Mail and Guardian (Johannesburg)","","","Business and Finance;Spotlight On Media in South Africa","440 words"," Africa News","","",
"Mail and Guardian (Johannesburg)","","","Business and Finance;'Bop Broadcasting Going Bust'","1667 words"," Africa News","","",
"Marion Edmunds, Mail and Guardian (Johannesburg)","","","Business and Finance;Black Firm Gets Contract to Market South African Provinces","400 words"," Africa News","","",
"Mail and Guardian (Johannesburg)","","","Business and Finance;Calling All Foreign Investors","800 words"," Africa News","","",
"Mail and Guardian (Johannesburg)","","","Business and Finance;Crisis Hits 'One City' Tax Plan In South Africa","1667 words"," Africa News","","",
"Mail and Guardian Reporter, Mail and Guardian (Johannesburg)","","","Business and Finance;World Bank Emphasizes Partnership","360 words"," Africa News","","",
"Mail and Guardian (Johannesburg)","","","Business and Finance;'Governments Can Say No'","867 words"," Africa News","","",
"Mail and Guardian (Johannesburg)","","","Business and Finance;South African Budget Deficit On Track","1307 words"," Africa News","","",
"Julia Grey, Mail and Guardian (Johannesburg)","","","Science and Health;South African Farmers Slow To Go Organic","1280 words"," Africa News","","",
"Mail and Guardian (Johannesburg)","","","South Africa;Truth Dies At Spy's Grave","2067 words"," Africa News","","",
"Mail and Guardian (Johannesburg)","","","South Africa;Judging the Dangers Of A Jury (Column)","880 words"," Africa News","","",
"Krisjan Lemmer, Mail and Guardian (Johannesburg)","","","South Africa;Life On the Southern Tip (Column)","640 words"," Africa News","","",
"Mail and Guardian (Johannesburg)","","","South Africa;Putting Party Before Country (Editorial)","427 words"," Africa News","","",
"Mail and Guardian (Johannesburg)","","","South Africa;Mores Of a Ghost In Red Socks (Editorial)","547 words"," Africa News","","",
"Caitlin Davies, Mail and Guardian (Johannesburg)","","","Botswana;Sugar Plantation Row in Botswana","960 words"," Africa News","","",
"Thomas Lippman, Mail and Guardian (Johannesburg)","","","Africa-at-Large;Africa Force Plan Revised","494 words"," Africa News","","",
"Chris McGreal, Mail and Guardian (Johannesburg)","","","Rwanda;'Chaos' At Genocide Tribunal","1067 words"," Africa News","","",
"Iden Wetherell, Mail and Guardian (Johannesburg)","","","Zimbabwe;US Report Slams Human Rights Record","694 words"," Africa News","","",
"Mail and Guardian Reporter, Mail and Guardian (Johannesburg)","","","Namibia;President and Swapo's Gay-Bashing","334 words"," Africa News","","",
"Zakes Mda, Commentary, Mail and Guardian (Johannesburg)","","","South Africa;Why We're Losing Our Top Black Pros","2494 words"," Africa News","","",
"Mail and Guardian (Johannesburg)","","","South Africa;Quest For The Truth And A Shallow Grave","1160 words"," Africa News","","",
"Mail and Guardian (Johannesburg)","","","Science and Health;Aids Agony Over Drug Clampdown in South Africa","1120 words"," Africa News","","",
"Stuart Hess, Mail and Guardian (Johannesburg)","","","South Africa;Claims That Rates Row Is Mandela's 'Revenge'","480 words"," Africa News","","",
"Mail and Guardian (Johannesburg)","","","South Africa;Fight For The Right To Be Coloured","1627 words"," Africa News","","",
"Jacquie Golding-Duffy, Mail and Guardian (Johannesburg)","","","South Africa;Broadcast Group's Plan For SABC 'Too Costly'","520 words"," Africa News","","",
"Mail and Guardian (Johannesburg)","","","South Africa;Ronnie Has A Bust, Winnie Has Nothing","1160 words"," Africa News","","",
"Mail and Guardian (Johannesburg)","","","South Africa;Hani 'Conspirator' Was Intelligence Man","1187 words"," Africa News","","",
"Angella Johnson, Mail and Guardian (Johannesburg)","","","South Africa;'Third Force Fuels Taxi War'","574 words"," Africa News","","",
"Mail and Guardian (Johannesburg)","","","South Africa;News In Brief","707 words"," Africa News","","",
"Marion Edmunds, Mail and Guardian (Johannesburg)","","","South Africa;Government Loses R1-bn Yearly To Pension Fraud","560 words"," Africa News","","",
"Mail and Guardian (Johannesburg)","","","South Africa;Massacre Trial Misfires","814 words"," Africa News","","",
"Gustav Thiel, Mail and Guardian (Johannesburg)","","","Sports - General;Cricket: South African Chief's 'Unruly Behaviour'","480 words"," Africa News","","",
"Mail and Guardian (Johannesburg)","","","South Africa;Student Newspaper's Top Dogs Brought To Heel","760 words"," Africa News","","",
"Tangeni Amupadhi, Mail and Guardian (Johannesburg)","","","South Africa;Police Worried About The Rise In Mob Action","614 words"," Africa News","","",
"Mail and Guardian (Johannesburg)","","","South Africa;Street justice rules in the north","1147 words"," Africa News","","",
"Panafrican News Agency","","","Sports - Soccer;Sacked Coach Drags Nigerian Sports Minister To Court","214 words"," Africa News","","",
"Panafrican News Agency","","","Uganda - Sudan;Uganda Accuses Sudan Of Bombing Border Town","214 words"," Africa News","","",
"Panafrican News Agency","","","Liberia;Ecomog Says Command Structure Of Warring Factions Ineffective","494 words"," Africa News","","",
"Paul Ejime, PANA Staff Correspondent, Panafrican News Agency","","","Nigeria;Joint Task-force To Probe Nigerian Bombings","400 words"," Africa News","","",
"Panafrican News Agency","","","Kenya;Former Kenya Airways Workers Sue For Compensation","267 words"," Africa News","","",
"Lionel Williams, PANA Correspondent, Panafrican News Agency","","","United States and Africa;Al Gore Expected for U.S.-South Africa Meeting","374 words"," Africa News","","",
"UN Department of Humanitarian Affairs","","","East Africa; Emergency Update No. 100 on the Great Lakes (02/13)","1587 words"," Africa News","","",
"Congress of South African Trade Unions (COSATU)","","","South Africa; COSATU Statement on the Executive Committee Decisions","1894 words"," Africa News","","",
"UN Department of Humanitarian Affairs","","","Rwanda; Statement by International NGOs Working in Rwanda","374 words"," Africa News","","",
"UN Department of Humanitarian Affairs","","","East Africa; Emergency Update No. 101 on the Great Lakes (02/12)","1800 words"," Africa News","","",
"UN Department of Humanitarian Affairs","","","Burundi; UN Humanitarian Situation Report - Burundi (01/29-02/04)","2747 words"," Africa News","","",
"Elias Abebe, Ethiopian News Agency","","","United States and Africa;Summit To Focus On Investment, Job Creation","454 words"," Africa News","","",
"Ethiopian News Agency","","","Ethiopia;Court Hears Testimonies of Prosecution Witnesses","320 words"," Africa News","","",
"Asfaw Gemeda, Ethiopian News Agency","","","Business and Finance;313,000 Tonnes of Fertilizer Available for Distribution","334 words"," Africa News","","",
"Ethiopian News Agency","","","Ethiopia;ETTE Workers Support Reorganisation of CETU","454 words"," Africa News","","",
"Ethiopian News Agency","","","Ethiopia;SEPDA constructs 1,500 km road","307 words"," Africa News","","",
"Ethiopian News Agency","","","Ethiopia;Authority Set to Meet Addis Water Needs","187 words"," Africa News","","",
"Ethiopian News Agency","","","Science and Health;Migrant Bird of Prey Found Dead in Ethiopia","147 words"," Africa News","","",
"Kisut G/Egziabher, Ethiopian News Agency","","","Ethiopia;SPO Files Charges Against 5,198 Derg Defendants","654 words"," Africa News","","",
"Ethiopian News Agency","","","Business and Finance;Ethiopian President Calls On Entrepreneurs To Intensify Investment","307 words"," Africa News","","",
"Kisut Gebre-Egziabher, Ethiopian News Agency","","","Ethiopia;Prime Minister Meles Reports to Parliament","2160 words"," Africa News","","",
"Western Sahara Referendum Support Association","","","Western Sahara;Sahara Weekly News Update (02/03 - 02/16)","440 words"," Africa News","","",
"Akaninyene Esiere, Theweek (Lagos)","","","Business and Finance;Nigeria: Everyone A Billionaire","1560 words"," Africa News","","",
"Peter Akpona, Theweek (Lagos)","","","Nigeria;Out He Goes","840 words"," Africa News","","",
"Saleh Buba, Theweek (Lagos)","","","Business and Finance;Nigerian Aviation - Death at Noon","707 words"," Africa News","","",
"Emmanuel Ado, Theweek (Lagos)","","","Nigeria;Sambo's Cross","827 words"," Africa News","","",
"Wisdom Dike, Theweek (Lagos)","","","Nigeria;Their Own Agenda","814 words"," Africa News","","",
"Theweek (Lagos)","","","Nigeria;A New Opposition Platform","1240 words"," Africa News","","",
"Panafrican News Agency","","","Burundi;Costly Resettlement Of Displaced People in Burundi","294 words"," Africa News","","",
"Panafrican News Agency","","","Mozambique;South African Chamber Interested In Niassa Wildlife","494 words"," Africa News","","",
"Panafrican News Agency","","","Sudan;Security Forces Recover 180 Stolen Camels","214 words"," Africa News","","",
"Peter Masebu, PANA Staff Correspondent, Panafrican News Agency","","","Africa-at-Large;Burkina Minister Deplores High Illiteracy In Africa","614 words"," Africa News","","",
"Panafrican News Agency","","","Sudan;Bashir To Visit South Africa","240 words"," Africa News","","",
"Panafrican News Agency","","","Liberia;West African Ministers Insist On May Election","454 words"," Africa News","","",
"Paul Ejime, PANA Staff Correspondent, Panafrican News Agency","","","Nigeria;Nigeria Loses 285,000 Square Kilometres Of Land To Erosion","440 words"," Africa News","","",
"UN Department of Humanitarian Affairs","","","Burundi; UN Humanitarian Situation Report - Burundi (02/05-02/12)","2187 words"," Africa News","","",
"UN Department of Humanitarian Affairs","","","East Africa; Emergency Update No. 102 on the Great Lakes (02/15-17)","2334 words"," Africa News","","",
"African Eye News Service","","","Business and Finance;Kenyan President Denies Letter to Mpumalanga Parks Board","1240 words"," Africa News","","",
"Ethiopian News Agency","","","Business and Finance;Pharmaceutical factory inaugurated in Adigrat, Ethiopia","254 words"," Africa News","","",
"Ethiopian News Agency","","","Ethiopia;Martyrs' Day 60th anniversary commemorated","187 words"," Africa News","","",
"UN Department of Humanitarian Affairs","","","East Africa; Emergency Update No. 105 on the Great Lakes (02/20)","1574 words"," Africa News","","",
"UN Department of Humanitarian Affairs","","","Rwanda; FEATURE: Rwandan Genocide Trials","3667 words"," Africa News","","",
"Peter Masebu, PANA Staff Correspondent, Panafrican News Agency","","","Africa-at-Large;New Forms Of Slavery Emerge In Parts of Africa","654 words"," Africa News","","",
"Panafrican News Agency","","","Mozambique;Zimbabwe, South Africa Rescuing Mozambican Flood Victims","974 words"," Africa News","","",
"Panafrican News Agency","","","Mozambique;Maputo Post Office Robbed","160 words"," Africa News","","",
"Panafrican News Agency","","","Business and Finance;Zimstocks Among World's Top-Four","480 words"," Africa News","","",
"Panafrican News Agency","","","Business and Finance;Ghana's Economy Grew 5.2 Percent In 1996","480 words"," Africa News","","",
"Michael Morris, Cape Argus (Cape Town)","","","South Africa;Games Bid Wins IOC Thumbs-Up","640 words"," Africa News","","",
"Dr Richard Pankhurst, Addis Tribune (Addis Ababa)","","","Ethiopia;A History of Early Twentieth Century Ethiopia (7)","1587 words"," Africa News","","",
"Our Staff Reporter, Addis Tribune (Addis Ababa)","","","Ethiopia;Yohannes Asrat- Keeping You Fit","894 words"," Africa News","","",
"Our Staff Reporter, Addis Tribune (Addis Ababa)","","","Africa-at-Large;Nile 2002 To Discuss Balanced Use","120 words"," Africa News","","",
"Our Staff Reporter, Addis Tribune (Addis Ababa)","","","Ethiopia;Road Fund Proclamation Discussed","240 words"," Africa News","","",
"Our Staff Reporter, Addis Tribune (Addis Ababa)","","","Ethiopia;Residents Get their Hands on Basic Infrastructure","640 words"," Africa News","","",
"Tamrat Bekele, Addis Tribune (Addis Ababa)","","","Ethiopia;Export - a Key to Development (Editorial)","280 words"," Africa News","","",
"Our Staff Reporter, Addis Tribune (Addis Ababa)","","","Business and Finance;Ethiopia's Navy Ships to be Sold for Scrap Metal","147 words"," Africa News","","",
"Our Staff Reporter, Addis Tribune (Addis Ababa)","","","Business and Finance;Addis Chamber To Elect New Officials","294 words"," Africa News","","",
"Our Economics Correspondent, Addis Tribune (Addis Ababa)","","","Business and Finance;Rising Coffee Prices May Inject Buoyancy into Ethiopian Economy","1440 words"," Africa News","","",
"Our Staff Reporter, Addis Tribune (Addis Ababa)","","","Ethiopia;Eugene Chiavaroli, PACT Representative Passes Away","214 words"," Africa News","","",
"Our Staff Reporter, Addis Tribune (Addis Ababa)","","","Ethiopia;Twenty-Four NGOs on the Verge of Losing Legal Status","200 words"," Africa News","","",
"Our Staff Reporter, Addis Tribune (Addis Ababa)","","","Ethiopia;Court Sentences M/General Haylom's Killer to Death","134 words"," Africa News","","",
"Jon Swift, Mail and Guardian (Johannesburg)","","","Sports - General;GOLF: Drought broken, now for the flood","987 words"," Africa News","","",
"Jon Swift, Mail and Guardian (Johannesburg)","","","Sports - General;CRICKET: Looking for balance in the batting","814 words"," Africa News","","",
"Paul Weaver, Mail and Guardian (Johannesburg)","","","Sports - General;CRICKET: Exile Crowe returns as Kiwis batting coach","1107 words"," Africa News","","",
"Adam Sweeting, Mail and Guardian (Johannesburg)","","","Sports - General;MOTOR RACING: Stewart to renew chequered career","1320 words"," Africa News","","",
"Andrew Muchineripi, Mail and Guardian (Johannesburg)","","","Sports - Soccer;Buccaneers ready for rich pickings in Africa","1120 words"," Africa News","","",
"Jon Swift, Mail and Guardian (Johannesburg)","","","Sports - General;RUGBY: Our Opponents Must Be Smiling","1214 words"," Africa News","","",
"Mail and Guardian (Johannesburg)","","","Arts and Entertainment;FILM: Give up, give up for Jesus","827 words"," Africa News","","",
"Suzy Bell, Mail and Guardian (Johannesburg)","","","Arts and Entertainment;FINE ART: The seduction of confusion","347 words"," Africa News","","",
"Glynis O'Hara, Mail and Guardian (Johannesburg)","","","Arts and Entertainment;IN YOUR EAR (Column)","814 words"," Africa News","","",
"Mail and Guardian (Johannesburg)","","","Arts and Entertainment;DANCE: Swanning about","680 words"," Africa News","","",
"Bongani Ndodana, Mail and Guardian (Johannesburg)","","","Arts and Entertainment;Operation opera","680 words"," Africa News","","",
"Mail and Guardian (Johannesburg)","","","Arts and Entertainment;MUSIC: The making of a diva","1240 words"," Africa News","","",
"Maria McCloy, Mail and Guardian (Johannesburg)","","","Arts and Entertainment;RADIO: Where are the spin sisters?","1294 words"," Africa News","","",
"Adam Haupt, Mail and Guardian (Johannesburg)","","","Arts and Entertainment;Back to their roots","680 words"," Africa News","","",
"Hazel Friedman, Mail and Guardian (Johannesburg)","","","Arts and Entertainment;ART: Givon's signs of the times","1040 words"," Africa News","","",
"Glynis O'Hara, Mail and Guardian (Johannesburg)","","","Arts and Entertainment;MUSIC: Tusk takeover?","400 words"," Africa News","","",
"Mail and Guardian (Johannesburg)","","","Arts and Entertainment;FILM: Clark's in town!","560 words"," Africa News","","",
"Arthur Goldstuck, Mail and Guardian (Johannesburg)","","","Business and Finance;WEB FEET: Notes from the Net (Column)","587 words"," Africa News","","",
"Jacquie Golding-Duffy, Mail and Guardian (Johannesburg)","","","Business and Finance;Network Service May Shut Down","587 words"," Africa News","","",
"Mail and Guardian (Johannesburg)","","","South Africa;'No longer NP mouthpieces'","1054 words"," Africa News","","",
"Lyndall Campher, Mail and Guardian (Johannesburg)","","","Business and Finance;South Africa: SPOTLIGHT ON MEDIA","587 words"," Africa News","","",
"Mail and Guardian (Johannesburg)","","","Business and Finance;South Africa: R1m to Fight Ad Crackdown","1494 words"," Africa News","","",
"Fay Davids, Mail and Guardian (Johannesburg)","","","Business and Finance;A New Generation Of Qualified Miners Emerges","960 words"," Africa News","","",
"Mail and Guardian (Johannesburg)","","","Business and Finance;South Africa: 'Capitalise on Benign Markets'","1067 words"," Africa News","","",
"Fay Davids, Mail and Guardian (Johannesburg)","","","South Africa;Forum for Farmworkers","320 words"," Africa News","","",
"Mail and Guardian (Johannesburg)","","","Business and Finance;South Africa: No stamp for bank Bill","1080 words"," Africa News","","",
"Mail and Guardian (Johannesburg)","","","Business and Finance;BUSINESS BAROMETER","440 words"," Africa News","","",
"Mail and Guardian (Johannesburg)","","","Swaziland;Union's Swazi threat","974 words"," Africa News","","",
"Mail and Guardian (Johannesburg)","","","Science and Health;South African Astronomer Finds Space Is Great","880 words"," Africa News","","",
"Mail and Guardian (Johannesburg)","","","South Africa;Deadly Symbolism of the Gun (Commentary)","2200 words"," Africa News","","",
"Mail and Guardian (Johannesburg)","","","South Africa;OFFICE OF THE PRESIDENT (Column)","667 words"," Africa News","","",
"Mail & Guardian Reporter, Mail and Guardian (Johannesburg)","","","South Africa;Truth Commission Hit by Corbett's Off-Key Swansong","254 words"," Africa News","","",
"Serjeant, Mail and Guardian (Johannesburg)","","","South Africa;AT THE BAR: Law can't always be moral (Column)","774 words"," Africa News","","",
"Mail and Guardian (Johannesburg)","","","South Africa;TEN YEARS AGO (Column)","200 words"," Africa News","","",
"Krisjan Lemmer, Mail and Guardian (Johannesburg)","","","South Africa;LIFE ON THE SOUTHERN TIP (Column)","574 words"," Africa News","","",
"Mail and Guardian (Johannesburg)","","","South Africa;The 'new new' NP: Chicken or egg? (Editorial)","520 words"," Africa News","","",
"Mail and Guardian (Johannesburg)","","","South Africa;A Nation Of Infidels (Editorial)","480 words"," Africa News","","",
"Iden Wetherell, Mail and Guardian (Johannesburg)","","","United States and Africa;US Slams Zim's Human Rights Record","494 words"," Africa News","","",
"Ruaridh Nicoll, Mail and Guardian (Johannesburg)","","","Swaziland;Unions gun for Mswati III","654 words"," Africa News","","",
"Anthony Kunda, Mail and Guardian (Johannesburg)","","","Zambia;Clampdown on press freedom in Zambia","600 words"," Africa News","","",
"Caitlin Davies, Mail and Guardian (Johannesburg)","","","Botswana;Okavango May Get 'Wildlife-Friendly' Fences","267 words"," Africa News","","",
"Chris McGreal, Mail and Guardian (Johannesburg)","","","Zaire;Mobutu on the Defensive","960 words"," Africa News","","",
"Lesley Cowling, Mail and Guardian (Johannesburg)","","","Science and Health;South African Scientists Want A Bug On The Case","480 words"," Africa News","","",
"Mail and Guardian (Johannesburg)","","","South Africa;THE ANGELLA JOHNSON INTERVIEW? The last hope for lost causes","1587 words"," Africa News","","",
"Marion Edmunds, Mail and Guardian (Johannesburg)","","","South Africa;Skilled Foreigners 'The Solution' To South Africa's Brain Drain","440 words"," Africa News","","",
"Mail and Guardian (Johannesburg)","","","South Africa;No Gays As Clergy, Say South African Churches","1507 words"," Africa News","","",
"Marion Edmunds, Mail and Guardian (Johannesburg)","","","South Africa;Government To Dethrone Np's 'Kings'","387 words"," Africa News","","",
"Jacquie Golding-Duffy, Mail and Guardian (Johannesburg)","","","South Africa;Martin Locke Lands A Top Job","480 words"," Africa News","","",
"Mail and Guardian (Johannesburg)","","","South Africa;Malan's Disgraced Advocate Is Back","854 words"," Africa News","","",
"Gustav Thiel, Mail and Guardian (Johannesburg)","","","South Africa;And Now For Death On Demand","907 words"," Africa News","","",
"Mail and Guardian (Johannesburg)","","","South Africa;Portnet Head In Witch-Hunt","787 words"," Africa News","","",
"Rehana Rossouw, Mail and Guardian (Johannesburg)","","","South Africa;Mps' Asset Register Based On 'Good Faith'","667 words"," Africa News","","",
"Rehana Rossouw, Mail and Guardian (Johannesburg)","","","South Africa;Ivy's Challenger Seeks Crucial ANC Minutes","507 words"," Africa News","","",
"Mail and Guardian (Johannesburg)","","","South Africa;Dolphin's Dicey Credentials","1107 words"," Africa News","","",
